,username,tweet,cluster
40,00mario,People don t like the music link thing Miss      ,31
49,00sam7,@littlebigchris  It s going to be okay  Chin up Mr  Seams different here my lunches will be lonely  I miss you Andrew  haha ,31
317,0ttilie,phoenix    gt  japan is about 6 000 miles  i miss matt ,31
388,101Denise,@franzne online for 3 or 4 hours   dang  that s torture  dude   i wanna go to the metro station s concert   @franzne i ll miss you   Good morning   haha  okay  enough with all the drama stuffs    i ll just miss being online 24 7  ,31
405,103Julia,I m SO sad I m going to miss MICHAEL JACKSON in London  ,31
649,13Nina13,i miss my baby ,31
705,13zengirl,I agree  Those r the ONLY 2 stations i listen 2  U miss 98 rock  i miss 105 9  may they rest in peace ,31
735,14cami,@belu jb i miss you too  ,31
778,16missedcalls,Been sad all day because of the weather  Got sick today   That s why I didnt update any tweets earlier  I wont be able to go to church today  @niellimartinez Aww  gt  lt  Thanks  bes  HAHA  Shucks  tanda ko na  Hahaha  I LOVE AND MISS YOU TOO  OHMYGOD It s my 1ooth tweet   Wooh  Hahaha  #myweakness HA     Video games  Wii  PSP  PS3  PC games  name it  I MISS ROCK BAAAAND ,31
876,1995emma,i miss venice already ,31
966,1Day2BEAwesome,I really don t miss my job    I just miss my job title    I know being a stay at home mom is best for the fam  but it s hard to stay  hot  My dad saw his surprise family portrait we got for him for father s day     Stupid facebook ,31
1250,1lovebug,cant wait to go to texas   i think  miss my daddy ,31
1285,1nanny,so  @tracekase  you ll keep an eye on our crip @machethigpin today  right  ya miss me girls   I slept till 8 30 ,31
1315,1pierce4u,Sweet  More kisses 4 me  I miss u 2      Can t wait to see u      ,31
1654,28starz,Why do guys gota break girls hearts      i wana send a shout out to my friend cristy hope u feel better cuz we miss u ,31
1662,2AWKWARD,@mttyrcks I miss you   ,31
1671,2Bnokki,My cousin was called home to be with the Lord last night    RIP Peaches I love you and i will miss you   Today was a hard day ,31
1698,2JR,Im going to play Swat4 now  Good bye twitter    I Will Miss you baby  Meet up again in about 2 hours ,31
1704,2LegitTooQuit,Gotta get ready for basketball  won t be back til like 3 30  @gabbyalegre aww i miss you too bby booo ,31
1757,2bincontrol,Had fun at the carnival with the bff  middle school jid are sluts these days  Gonna visit my husband  i miss him lt 3,31
1783,2dafutur,@SantriseNicole hey sexy lady  You were all busy my last day there   Does Chicago miss me ,31
1806,2fly2Bking,Well I guess this is my last text  I miss u @zinbunny jus textd that 2 me but I don t exist tho lmfao realest nigga in existence is ME,31
1837,2khris10,seen my baby today but i miss him  he only been gone like 2 hrs but still    ,31
1888,2piece_352,Something wrong wit my stomache wishin bay was here miss you ,31
1906,2sharp,I m going home  It s been a LONG day    I have a KC company looking at me  I hope they can afford me  I miss my mom and dad     ,31
1952,300594x,Ahh  I hope Miss Kenney is doing okay  It s awful what s happened   ,31
1970,30David,@KellieBach I miss shibuya ,31
1988,30lp30,@auditiondanny when you leave it is more then  kind of sad   i can t believe you went to Vegas so close to me  we miss eachother again ,31
2100,3AineBainne,@Amie Xox i miss you   X,31
2262,3ebgary,Not feeling well    probably going to miss day 2 of camp  ,31
2277,3hirdteenthirty,I miss ally nat sher cal jaz K sheri fel   Omg miley cyrus is following me  haha okay today is rly depressing  i was on the verge of crying    Life s a bitch  Calling ally    Mizzzz herrrrr  Ruth call me backk    Mom says she s out late   i miss yall so muchhh  Argh I LOVE ALL MY BESTIES      YAY  I am so so sad   Friends cant make it for the hannah Montana movie on thrus and i cant get my newsletter done Tmr s the launch party of Sims3  And i really wanna be there  It s sad   like justin broke up with miley or whatever it is   I think she s real better with justin than nick    hey guys i tried uploading my picture but i cant  It s taking FOREVER  sry   Will try again soon k  I miss my childhood friend ruth     I love her so muchhhh  I just called and her mom said shes out  I cant wait to get on the line w her  ,31
2280,3i4ai,i really miss you vivi     hiks  hiks   ,31
2305,3lvira,@pawpaws eres una espia  I love u girl and I miss u too ,31
2406,3yz,Suddenly I missed @msmorgana terribly  I miss you 2monthsmom ,31
2465,44lala44,@Slimmy21  same here girl  last yr  but imma miss it tho   ,31
2505,4ETechPrezMegan,you re worrying me sick    i dont know whats going on  if anyone got hurt  if you re hurt emotionally  i miss you like crazy   asdfghjkl ,31
2506,4EVERKY,@IMONEYDABADDEST lmao awwwww hunnie i miss u moreeeee  hope u come on thursday ,31
2646,4kids5,Ok  fine  back to reality  Going to cook up some breakfast for my babies  Hubbies at work   I miss him  Tweet to you later   ,31
2744,50centfranks,Had a great lunch with my BFF  Gonna miss her when she leaves ,31
3060,6trung,I miss Baseball     the band not the sport   ,31
3200,7love2,KHR tomorrow   Sigh    I miss him  ,31
3249,808kidd,@projectrika belated hbd loooves  miss you lmao ,31
3451,90daysinParis,I miss Justin  ,31
3454,90rachal,I miss talking to ppl and replaying to there tweets  I miss own Internet conection   my lecture starts in 4 min  wow   LOL kiki moment  those real house wives spend money like crazy    I felt sad for Lindsay  trying to have an afternoon nap but i dont think its gonna happen with girls planing OUT LOUD   gives an evil look  and too much caffien  http   twitpic com 6c0yw   i miss thoses days  I want home  @francesca7 adventureland    where did u get it from ive bee trying to download it  @francesca7 haahah video tape her xD while telling her  I almost died when they told me wwntworth miller is gay  wish Taylor was on @xtaylorrrrrrr  when will tmw come  last time I had this kind of tantrum was my grandfather died 2 years ago  my head hurts and my throught and my nose even my eyes hurt   feelin better I just wish the take the IV off  I want to go home  no more spicy food no more being angry so I won t end up here  fucking doctors those scars will never go  morning all twitters  miss me   @kiki miacherry morning kik enjoy your breakfast  morning  have u seen my yellow converse     Who took it     @Gtwilighter LOL grace im in with ya  @francesca7 i guess so and there is a really fuuny pic u would know it if u saw it  what a day woke up late lost my earings FOUND my moms earing while i was looking for mine THEN FOUND THEM  in my sisters room so its a happy morning so far  I m not going to touch my laptop    Gotta challnge my inner nerd and study my ass off starting after 8 min,31
3511,954GiRL4LiFe,Working my ass off  @jstar0731 I miss you more boo ,31
3515,957wkml,Heart heavy with the loss of Buddy Pitman  One of the finest folks at WKML  We ll miss you  ,31
3694,AAWMAN,@MISSMYA    Miss Mya u gotta get sleep     come on  just 2 hours    jus do it ,31
3722,ABCDEFUCKYOU,i miss hamish  it feels weird not being able to see him tomorra   i am excited about going to see a day to remember soon though  ,31
3779,ABgotsass,i already miss senior week  ,31
3945,ADKbkpker,Three photoshoots a day to pack and then I m off to Maine  Gonna miss coaching my Conestoga team    but that is the only thing I ll miss ,31
3960,ADRI86,Aaaand im crying  Marley and Me is the saddest movie ever  Makes me miss my puppy roxie  ,31
4035,AFHS,excitedly awaiting the arrival of the wii  But I ve got to go back to hospital this afternoon so I might miss it  ,31
4215,AJDill,Flying back to the state i called home for 18 years for elevate  Miss my baby girl ,31
4240,AJPeltier,I miss my baby girl ,31
4246,AJRCY,it s Julie s last day in the office before heading back to the UK for good  Cyprus will miss her ,31
4297,AJonasBro,@ayerdon185 gonna miss you more   @Nick1556 Omg dont say that   Damn  I m going to miss this  Good times with good people last night  Gonna miss mah fran   Spending time with Angela before she leaves  ,31
4321,AKAPoon,@songzyuuup u slippin on yo twitt  I would have liked to know u were in my city today   Now Imma miss u   ,31
4377,AKreed805,@miss laalaa I miss you too love  can t wait to see you tomorrow  ,31
4588,AMK001,Just finished exercising for the first time in awhile  I feel so much better  However  I miss my friend Brian terribly ,31
4599,AMMSX,RIP WHATABURGER  Last triple meat and triple cheese with bacon  We will miss you ,31
4618,AMShowen,@CRSarah BE Awesome view  I miss Chi town   Say hello for me  SO depressed cause our dorm is showing MILK Wed  night and I can t go because I have a meeting   I m so bummed b c the theater company in Charleston is doing Rent this summer and I can t audition cause a  internship job and b  vacay  FAIL WHALE   Spending some quality time with @chrismmat and @roelmore  Gonna miss them this summer   @RyanOConnor Totally feeling your pain right now   TOS  deserved best book   #tonys Back from training  First actual day in the office tomorrow   I m so pumped    Working tonight at 6   I m bummed cause I can t vote for the Teen Choice Awards as I am no longer a teen   Ah  the woes of growing up  @bryanblaise I have no idea how I missed your post from Wed  but MAJOR KUDOS  Left you a comment   @JenHug Thanks  You can take one or two for me if you miss them    ,31
4669,AMichelle1,Traffic to coachella is a biatch  Think we ll miss joss stone  @hayleydiamond you re already missed on the 6th floor   ,31
4670,AMichelleY,@oneloveSP miss you ,31
4682,AMoonlessNight,I miss people already ,31
4701,ANAxs, i love you So bored  The way i still miss your voice makes me wanna fucking choke and die  Pineapple and cool whip with beaver nuggets    Only in texas ,31
4707,ANDI_TEARDROP,in the mood ta listen to BROKENCYDE OR SOME ALLTIMELOW   @michaelflys Aww I miss everything about you ,31
4809,APES,I miss singing already  @Floris Thanks Dinggggggg  lt 3     Have a wonderful Tuesday  @BobbyAFC Try google for the recipe  Bob  p     Bananacue     My fave  @socalpie You re always welcome pretty Pie    I  lt 3 you  @CalmChaos Thanks for the DM myCheryl    lt 3    miss you lotsa too   6 00pm   about to hit the shower   #church time @ 8pm   happy #Pacman day Y all  @TAURUSLADY09   getting by   thanks Rox       @dortoka you too Pabs   thanks always ,31
4833,AParkerMissAKA,Church with my favorite Little and Mentee    Miss Sandidge ,31
4871,AR71,@pellev According to the doc and the x rays  yes  My company car is most likely wrecked  but it has protected me  Still   I ll miss it ,31
5197,AVRed4,I m super disappointed that i m gonna miss out on the 4th flame concert I ve tried to go to in about a year    ,31
5205,AWBiggs,@princess2802 Haha  I miss the boy smells  No matter  got another month to get em back ,31
5207,AWESOMEwow,i realy miss my mom  new york is awesome i just saw shrek the musical ITS AWESOME          IF UR IN NEW YORK GO WATCH IT  ,31
5451,AabbiieeAlcopop,Reached the tree during maths  Mission complete  D  Miss you Mrs Sherwin  Love you     lt 3,31
5527,AaronCicada,Just finished a load of interviews for our Australian release    I miss that place ,31
5570,AaronRodriguez,@katfar I know I m pretty selfish  hahaaha      I m gunna fuckin miss you   miss you like a homeless person misses a shower  ,31
5649,AarynElanDoyle,@ddlovato omggg i love you girlyyyy  i miss you and the rest of the camp rock cruuu    @Jonasbrothers heyy boys  how are you  i miss you guys soooo much   pray for @mileycyrus    i hope you get it mileeyyy ,31
5716,AbbeyHilton,I m going to miss kitty and my other animals  But it s only for 4 days  I know that they miss me too   Mommy is coming back soon ,31
5757,AbbieKinno,Want my dad back  fathers day tomorrow and i miss my dad ,31
5823,AbbyKaram,NYC to move my Anna in for the Summer   Gonna miss herrrr ,31
5827,AbbyLeighLA,Ran to the beach even though I m sore  Gorgeous outside  AND got to see Ascher  Going to miss him  Stupid Gatsby ate my earring though ,31
5833,AbbySchwabbbb,I miss him so much      @JennaRaeLove text me again cuz i didnt get it  13109611046 @Johnny Exp u make me smile     I m visiting grandma with a guy who has 4 letters in his name  hahhaha funny shit,31
5958,AbiKateFiedler,can t sleeeeeeep i miss the days of turning out the light and being out cold for 8 hours straight ,31
6050,AbonyAftershock,I miss my laptop  I loved today  Drinking mucho mango with Brittney ,31
6179,Acb87,Sooo tired 2day  think i ll have to give the gym a miss 2nite ,31
6248,Acererak,@Shitfuckdamn  hug  welcome to real life  mamut    @NRN IndyThink the combination of #Arby and #Wendy in a single unit is the death star for gastrointestinal tracts  I m jealous  @justinmj I do miss it  I love the sight of the L going by in the background   @Ravels aw  The bay will miss you too   The worst part of seeing your friends is knowing how long it ll be before you can see them again      still  having fun in chi town   @KeenanW agreed  it makes networking waaaay easy in that regard   I downloaded the iPhone app bebot the other day and  thanks to @ nickd  managed to piss off everyone within a 10 foot vicinity  Success  ,31
6502,AdamLStreetTeam,Watching American Idol  I miss that show ,31
6505,AdamLambertSexy,Oh man  I jus got home  i miss my friends and cedar point already ,31
6670,AddWankz,Monday night  what to do   I miss the frick out of Brenda   ,31
6761,AdeleMarie1130,@BoneCrusher311 i miss you come over asap ,31
6784,Adelinephuasw,I miss Edge  I can t wait for Friday s night  ,31
6835,Adia88310,Today I just miss my husband   ,31
6905,AdoBernardo,@leesimonbrown we miss you too bro  ,31
6908,Adolfh71,Going to mcdonalds  I miss annet and the crew  ,31
6921,Adoracion,At Oceans   kinda weird n not interesting   girls r on the dance floor  I miss my Husband  he s cuter than any1 here ,31
6984,Adrian1802,finally   schools over   gonna miss people  but on a happier note    highschool  ,31
7072,AdriannaYay,@amidatti What the hell Meeps I miss you  ,31
7105,AdrienneChung,I miss my underwater friends ,31
7125,Adrienne_KG,Found out I had locked the cat in my room this morning  Just finished scrubbing the peek out of the carpet  off to work  wont get home til 6 30ish  i miss my bed  i miss Eddy  can t wait til tomorrow finally comes   ,31
7164,Advenman81,I miss my old First car  Wow  Grad nite was really awesome  Imma miss those seniors ,31
7353,Afrigo,i miss my husband  not feeling too well today ,31
7493,AggieMoon,@seandaddy5 Yeah  can t believe it s already June   I miss u guys already T T,31
7508,AgiSophie,@youmeatsix I loooved your show yesterday  I already miss you guys ,31
7534,Agnmaia,I m sad today    miss my old life  miss my mama and my Grandmother  sad cloudy saturday ,31
7562,Aguss150795,another sad morning  today my dad is going to go to LA  I will miss him ,31
7637,Ahmillie,@DJ Double R Shhhppank you berry much  Me too   I miss the grey goose ,31
7675,Aicarnate,Aww comp acted up  I miss you already I miss my hollybee  but atleast we can phone eachother  snuggles,31
7856,Aimee_eng,My boyf is such a knob   I miss Turkey ,31
7864,Aimeegoesrawr,@XxAmyCanFlyXx awwwh Amy  its ok    hes just being a boy  i miss you  x,31
7914,Aingeleyz4u,@itsjudytime awww hope u enjoyed Germany  Hurry back we ur subscribers miss ur videos ,31
7933,Air1Scott,@MissEsther its finally over    Well the moving anyway    The unpacking us next    Ugh  Miss your voice too ,31
7983,AirliesBird,Feathers away in bournemouth all week    Miss him terribly ,31
8085,AizItuDia,who s next  im gonna miss my dear fren   ,31
8090,AjAH67,quite sad i have to miss out on the cws this year ,31
8105,AjaParales,@mislulu girl i miss u so much  hope u got back to romania ok  email me ASAP ,31
8169,AkaneLordsOfIce,Is ill    bUUUUU who wants to hug me   hmmmmmmmmmm     it  s been a while since we last talk but I still feel your breath on my neck    I miss you    ,31
8181,Akashabm,I miss you    So much ,31
8239,Akizirian,is around  game  then work  Has to miss Rock for Darfur ORHS  ,31
8297,AlExSwOrD,@smccrea dam when the showing of our video in church etc  or did i miss it @smccrea when the sunday night show were doin  or is that what i missed if i did im even more sorry Its coold   Gonna miss megan when shes goes to germany  and conor over the summer cuz he goes wither  i go listen to the emo kid song,31
8340,AlaaG,talking to my friends maro and tima    i miss them sooo much ,31
8592,AldiniM,@ReconChesty I Completely agree  He did have all those bailouts though  but he kind of had a gun pointed at his head to do it  I miss him ,31
8595,AldoMazzei,I Miss You   Great Day ,31
8679,AleezehK,back from the mall with @ZGarsidex and Diala  Gonna miss you so much Diala  cant believe your leaving me   ,31
8702,Alejandra_V,4 days to go  I miss my cats soooooooooooooo much ,31
8876,AlexCornett,@brettnolan I haven t read book 7 for a while  but I remember feeling the same   I wish there were more than 7 books   Is annoyed because I don t think it s fair  It s not fair to choose   @tlmo Hey  ya wanna follow me on this cursed social network  It is killing me slowly  Hey  We need to go to the movies soon   Miss ya   @EllenHayman Hey    How are you    I miss you    How s life  Made any plans on what s next   ,31
8878,AlexCox,home from six flags with the band   such a fun day   i miss everyone already  Packing and cleaning up the hogan  I m going to miss this place so much  Driving to the airport  Bah   Okay  after visiting SLU again I ve officiall decided that @MarquetteU will be my home next year  I m excited  Chicago with @maxdie and @derekbishe was quite fun  http   twitpic com 6t782,31
9054,AlexShaftsbury,has finally lost the plot  Please return to me brain   I miss the days when you worked ,31
9085,AlexWT,Here s almost 1 AM and I m staying with my open window   otherwise I d suffocate myself   It s way too warm  Ah   I so much miss rains    @lestatswife I hope you already feel better    Just think about WT and the problems are already solved   hehe That s valid for me too  I had my last semestial exam and look forward to getting the summer holiday  I shall go to Vienna but I ll miss you all a lot in a while   @Danielle ddb Yay   I m so happy to hear this  I thought I will not see until I ll not return from my summer holiday     Can t wait      @wtsof I love this new twitter theme      Congratulations on it   @AnnekeAnnique Aww   they re so cute   ,31
9086,AlexWehr,Back home  and i already miss noah  matt  alyssa  and everyone else ,31
9097,AlexZone,Rain and girls aloud missing the top ten  Great  i m home from peru  i miss it already  Finally got some new shorts  On my way to the airport ,31
9189,AlexaRandolph,I miss my techno twin  Michaela  soo much   I seriously just criedd    ,31
9550,Ali42188,I miss miss miss you already  I am terrible with goodbyes  terrible ,31
9596,AliJeanHughes,gym  bank  work   Gosh  I miss college  ,31
9610,AliMarie35,Ahh man  Back 2 Work 2morrow   DEF  Gonna Miss My Lil Man    G nite To My Few Twiggas lol,31
9624,AliSantini,@Madonna16 luvvv you   Miss you   I can t believe we were in Vegas a yr ago    Time flies  I better see you soon   xoxoxo,31
9625,AliSipra,Feel kinda nostalgic today  miss Deadwood and Gilmore     Someone cheer p by mentioning a show as worthy of watching ,31
9646,Ali_Addiction,ughhhh  i miss ashleigh   i have the worst luck in the fucking worlllld    ,31
9699,Alibongos,is going to miss the lovely sunshine today as I have to go into hospital for the day  is tired and achy ,31
9835,Alicemarshal,@sachakourkiva i need you  I miss you   paris sucks  come hooooome,31
9898,AliciaMerritt,Rip Andy winkler    We ll all miss u so much ,31
10004,AlinaBanana,i miss honeydew sago with coconut jelly ,31
10021,AlinePenhallow,@IzzyLightning thats awesome  I miss you tons  Im thinking of visiting in the next week ,31
10111,AlisonPerrin22,5 2 08   I miss you ,31
10131,Alison__x,i miss you already ,31
10185,Alixamazing,I miss you too it was so good seeing you  You looked great baby  I like you all scruffy  ,31
10413,AlliRabbit85,Just finished moving most of my stuff out my loft   I m really going to miss life on Peters street ,31
10452,AllieC13,Is sad she s watching the hills season finale  Will not watch it if kristin is in a new season  She s such a whore  Going to miss lauren @Jayde Nicole thank you for that tip ,31
10526,AllieluvJB,I m sad  Selena has only been nominated for ONE category  Red Carpet Icon  She sooooo should ve been nominated for Best TV Actress     UGH  My mom is not gonna be back in 2 hours   Darn  I ll have to wait more to get LVATT  @ddlovato omg cant wait for the premiere  BUT   sadly it doesnt premiere here in Brazil on the same day  its only in July  I miss @jonaslove128     I miss her series  I miss talking to her  even though I just did   I miss her  Jenny come back    sooon   Oh no  Just heard Tremi iss OFFICIAL   I really hate Tremi  noooooo  the old one came back  utube    i h8 u  I m gonna make a vid with all the bg s i WANTED to put     stinkin youtube ,31
10755,AllyandraF,@mindy17  I miss you  5 a m  SUCKS     Thank god for only a 4 hour shift  but is it truly worth it    I am thinking not  ,31
10868,AlmySidaKay,Happy and sad  I don t have to go into work until 3 25 today  but I miss out on my 12 Asian kids on a bus route  ,31
10885,AloisiaTethool,@TheLindsayLohan when are u planning to go to dubai again    i missed sam s party in sanctuary    wont miss it again this time  ,31
10900,AlonnaInVa,@ladycarter7 see I always miss out when I m workin  I ve been wantin some crabs and shrimp for the longest time now  ,31
11042,Alumn,@Lia Chan @Seowhow  Pastors  please rest well during your trip  gonna miss you guys like crazy  ,31
11104,Always_Tee,On the way to georgetown  Miss my child but godmommy steppin up  Tino keeping me busy ,31
11114,AlwyzSmiling,@XavionMGaBBana i guess ur not gonna miss me tomorrow ,31
11146,AlyLogan,P           IGONNA MISS YOU   S  Today is the baptism of my little and beautiful cousin Cadenet ,31
11189,AlyciaAnimation,@emmylucille Welcome  I m kind of bad about tweeting though  Miss You  ,31
11265,Alyson_Stoner,Can t wait for Camp Rock 2  Hope to see all my friends soon  Miss the JB  Demi and Anna ,31
11280,AlyssaAllen18,an amazing night with @luisoda im going to miss him so much when he leaves for cali in 2 weeks ,31
11296,AlyssaComolli,I just broke the news to my mom that I m not gonna be here for her birthday   She took it well though  Haha  @kerieonlee Haha  That s funny  I miss seeing you every day  I miss 5th period especially  ,31
11301,AlyssaDiaz95,My eyes just got tearful when I watched tonight s episode of American Idol again   @proudlyinsane We all are  BORED  Tsk   @jeanxtrisha Aw  I know  Me  too  I feel so useless  whenever I m bored  Idk why   Trying to think of something to do  Can t wait to go out later  I M SO BORED  SAVE ME FROM BOREDOM  ANYONE     @deezeen I know  pero available na yata eh  Sa Singapore  though   @marjorielu MISS YOU  TOO   Gotta grab some chow first  SIS  GIMME BACK MY PHONE  Seriously   So tell me  Is it still raining   Someone just told me that it s still raining  Aw  c mon  rain  please stop  Why  Because I hate you  So stop   I can t change my design colors  Is something wrong with Twitter   I feel like I ve abandoned my laptop  Aw   Yes  my laptop does feel abandoned  I m such a bad owner   @marjorielu MISS YOU  TOO     TOO MANY SCHOOLWORK  I don t know if I ll survive high school   HOME  amp  HOMEWORK   @marjorielu How are they  Still the same  Aw  I miss you guys   @proudlyinsane And now you re off the computer  TWEET YA LATER   Eating early dinner in front of my @DavidArchie poster  @marjorielu  what are you doing   @deezeen About the LR   Still not done with some schoolwork  Tomorrow is another day  Will sleep now  ,31
11304,AlyssaGrier,@tarynann I m going to miss you  @tarynAnn boo we re moving ,31
11342,AlyssaQuealy,I need to get xbox hooked up again  I miss it terribly ,31
11392,AlysssaAcevedo,so yeah  today was greatt  text me  @edenjonas haha yeah  i do too  so  how ve you been girl  i miss you    still talking to gabby  eventaully going to bed  running with lauren in the morning  probably showering after  then whatever  text me ,31
11442,Am_Real,@JulietLimaGolf when do I get to see my smooke a looke    I miss her  ,31
11513,AmandaAlyse,i cant go to sleep  is up at the school wishing i had made it here sooner  o well im back on my way home now   womp womp womP  i miss the times we almost shared  whoever said its impossible to miss what you never had  never almost had you     @QueenBea33 why were u mad   and ooh i wanna see ur hair ,31
11553,AmandaColeen,I m going to miss the marauding Vikings cheering as they pass ,31
11598,AmandaGrays,@kevinbeasley ty bobweiser  can you get me a new computer too  I miss my girls  ,31
11600,AmandaGulino,@kalanwarrick miss you  your Spain pictures on facebook look so fun though  ,31
11642,AmandaLSinger,@rijken then ud miss my party and that would be sad ,31
11748,AmandaRaeBoyd,@gabbigee and btw you should call me sometime because i miss my gabby ,31
11771,AmandaStars,still at Hollies  with Hunter and Karly  andd Benny     i miss my baby soo bad ,31
11905,Amandaxox52,@kelliecobra   omigosh  i miss all the old cn shows  @squeemo awww  i live kind of close so i can go down as much as i want  after i get a job  amp  car haha  now its only w  the family @iamdiddy http   twitpic com 6c7ro   awww  someone wanted to feed themselves  @kelliecobra I was a powerpuff girl myself  I miss those lazy days ,31
