,username,tweet,cluster
11937,AmaniFlimzzii,@emqatt You are soooooo Lucky     Gosh you re a senior next year  NO    @emqatt NO I don t want you to leave   its going to be SO sad  and you re gonna be sad you ll miss me    hahaha I really don t feel like it    But I have to   and @emqatt I miss you  Tweet tweet  love you @ddlovato  You are my idol ad my hero ,31
11979,Amaru279,I miss my water cuz my well went dry ,31
11996,Amaya_Izanami, my mother left today  She is going back to Oklahoma  Never lived in another state without my mom  Its weird  I m gonna miss her ,31
12077,AmberAutopsy,Back up and running  Miss me ,31
12183,AmberRAWWR,I just saw Drag Me To Hell  It was pretty good  but there was no gore  I think I ve gotten 6 hours of sleep the past 3 nights       I m never gonna see Darren again  I got a hug though   HA   Brandon fell asleep  Now I m lonely  I just realized that I probably won t ever see Erica again  @UnicornCherDen   I miss him too  You should text me on your dads phone   I miss youu     @UnicornCherDen   But I m not there ,31
12352,AmburrNicole,too bad darla couldnt stick around to see all of it and practical magic   @Frawnk but you are still mah man  lol i miss you   going home    im gonna miss my lover baby  ,31
12363,AmbzMox,@letsgeticecream I miss you   Come to Michigan like now    I can t wait till July ,31
12512,AmiFinley,ddlovato@ I miss you    ,31
12552,AmieRogowski,Just woke up it s 12 34 pm and there was only one update on @perezhilton  com  @alyseshaw i m gonna try to come to your purse party i m broke though   i miss you ,31
12586,Amiii_x,i miss you ,31
12684,AmmoxXx,@mileycyrus come ta Dublin pweese  I m wearing my uniform on a Saturday  Ammo lost her ear phones  not kool  Can t sleep cause of the stupid rain  @lo fox i miss london  screw that  i just miss mu boys  lol animal gig if i must say so muself    @savingaimee enjoy  my mates going to that  miss yis aaaallll  xxx @lo fox thank you darlin  exact same to you ,31
12738,Amoundaa,Chilin in my driveway with the dogs gt  imma miss them ,31
12867,AmyDahan,back in marylanddd miss RI and RK already  Jk stayin with @ariellejill one more nighttt ,31
12968,AmyKlatch,my insides are hurting    miss you     ,31
12984,AmyLeann,I miss the beach already ,31
12996,AmyLouiseLS,@RoodKid Ahhh  I loves you too david    xxxxxx Miss You  @RoodKid Ahhh  I loves you too david    xxxxxx Miss You ,31
13109,AmyTheStrange,I miss you so much Please back your self in the past  In the moment that i m feel very happy  Making A bracelet and necklace  hohohoho i will upload the pict s later after i finish this ,31
13126,AmyWentz,i miss you too @brookebelch   ,31
13127,AmyWildes,@HowLostWeAre CHANGE YOUR TWITTER  im not mean  @pacificavita THANKS FOR INVITING MEEEEEEE   @HowLostWeAre  you need to be careful dear  @poopiesanchez sounds perfect   My kitty is the second best cuddler on this planet   @SpoonSucks i know  hangout soon please   oh the phone with joshyyy  i miss his big booty  Chores and then getting pretty  @kylawhite theres a black light party tonight  you two should come  text me if you want info i miss @HowLostWeAre and care about him so much   youre the best ,31
13177,Amy_Scibilia,@thomasscriven you should get on that i miss you guys ,31
13262,Amytello,i miss him   Hope he s enjoying his trip  on the other hand  super sore right now  volleyball ftw ,31
13265,Amyvides,a new day   hopefully its a good one    i miss him ,31
13298,AmzAngel12,Hey @quigzie19 their stil watchin the f1  lol x HeeHee x Miss Goyder  Im Gnna Miss Youu  x Soooo Much x Dnt Want Ya 2 Go  x OMG  Soooo Dint Expect Diversity 2 Win    x They Rock  Lol  ,31
13373,AnRoBBY,Awh  my jayjay baby misses me   i miss you too boo  Just think of it as a test  you either pass or you fail  piss me off and you fail  win me over and you pass  its that easy  ,31
13414,AnaEnjoli,God is working on me   @Moki921 awwweee so good to see you too     I miss my Moki  Until tomorrow   @kb3000 hey man  Can I be you   http   myloc me 2JjJ,31
13489,Ana_X,http   twitpic com 3m1y9   no more long hairs   gonna miss it  everyone from home is going to the beach today  amp  I m stuck in philly Drinking alone at your parents house is no fun   Ouchie  Somethings been biting me  Ovaries suck today too   they are hurting me  Well atleast the one is Working the Dolphin     Ps  I can t find my Wasted Cycles hoodie  @mojokiss I miss thee very very much  Your glasses can only comfort so much ,31
13533,Anais_loves_you,I miss my family  I am watching jon and kate plus 8  I feel so bad for them  Its 12 am and I can t go to sleep  I am scared of what I might dream  Because then I will miss him even more ,31
13542,AnalizLikesYou,You re gonna forget me once you leave  And I m going to miss you ,31
13562,Anandoo,@adamleber hey adam can u please post some of the tour videos up like sweet dreams break the ice and anything else  i miss them  and brit,31
13569,AnarborSlade,last day of the razias shadow tour  ill miss eveerybody,31
13604,AnastasiaVonB,nighty night to all twitterville   enjoy    miss me while i m gone   ,31
13629,Anays_,I miss you   if you knew   Mary you ll miss me  Why  shares you   How will I do without you  gonna be too hard  ,31
13748,Andie02,@CaterinaFalcone You are taking vacation    OMG it s about time  I m not going to miss you bc you re gonna bring me starbucks everyday  ,31
13756,AndieLiz,@cochick5280 that will be good  I miss Colorado   where do you work ,31
13767,Andiegirl123,@danecook   something came up and i m going to miss your show on May 2nd in Jersey  It was my birthday present from my girls   ,31
13777,Andiiemtz,@tommcfly aww Tom   Is there any chance you vould come over to Mexico again  We miss you so much    @dougiemcfly Hey Doug  Your lovely face is in Mexico s Tv now  Haha  you guys enjoyed being here  ,31
13785,Andinsaurora,@canadianbutter haha  yes i miss him so much  ,31
13786,AndisReks,@lauren roche   i kinda miss working there ,31
13805,Andra_Fedya,miss my boyfriend    i loved him     gt   lt ,31
13866,AndreaBordeaux,Can I tell y all a secret  I kinda miss LHCF  ,31
13881,AndreaCulotta,going to the doctor  Vacation to Lake George  Will be back sometime on Friday  Text or call me if you need me  I ll miss you all   lt 33333,31
13986,Andrea_Wrestler,And i missed Matt s match and some of Jeff s Anyone have it on youtube yet   @MATTHARDYBRAND I hope you feel better soon much love and support I Hope your surgery goes well will miss seeing you on raw though ,31
14050,Andreibenneth,miss my tommy  gosh  it s been a tough week for me not talkin to him   ,31
14234,AndrewTweeted,@neurostream I can t reply to your direct message because you re not following me  Miss you too ,31
14340,AnduTros,Just an observation  Aside from the riverwalk  there are pretty much no cute girls in downtown sa  I am sad because I ll miss the live conferences for E3 this morning ,31
14346,Andy1627,What a wonderful day   lot s of photos with all my friends   i will miss you a lot ,31
14390,AndyFabulous,@blakeberry33 awwwe shit girl I miss Deborah she was the HBIC     Omggg ANNA NICOLE ,31
14542,Aneesville,Lapa gile macam nak call the guyz eat at Barakath feel like eating prata      I miss us  Miss the old times with the guyz  Another sleepless night  Oh man  I m having flu again  Please let me be well tomorrow        Im with Shoe now  Miss her so much   ,31
14573,Aneurysm9,Ooh  Les Claypool coming to Town Ballroom 7 18  I ll be there  too bad I m going to miss the Black Crowes the next night ,31
14597,AngMecca,dear prospect ave  i will only miss the roomates  the apartment  and all them crazy parties  Goodbye  ,31
14630,Angel10A,Nope  in Cali hanging w  fam @Angel10A WHAT  You re not there    via @DefyGravity81  @joeymcintyre come out come out wherever U are      Tweet Us   We miss yah      via @BJoie ,31
14665,AngelBex696,I m sad because my brother is moving away today  and I have to see him off at the airport  must remember to take tissues  I ll miss him x Going to see @markreadmusic tomorrow  can t wait to finally see him perform his own music live,31
14712,AngelLilyAshley,@Giusyrz Yoooo Hunnie   This is Angel here    Hw re ya sweetie    I miss you      ,31
14779,Angela8185,heading home from the country   in the rain   if only @luke2184 was there    miss you too  wants her real phone back   and her long hair      still awake    my snoring pug keeps me up at night ,31
14799,AngelaDawn1987,lunch shopping and laying poolside with AB I love lazy sundays  But mostly I miss Christina   come home momma,31
14803,AngelaDowns,@IvyLaArtista No stepping away  now  No telling what you might miss  ,31
14840,AngelaMmusic,@selenagomez You really miss your BFF girl   ,31
14868,AngelaWiest,I miss charlie because his phone isn t working  ,31
14917,Angelberta,I miss my friends  Hope 2 see them ASAP    ,31
14952,AngelicBlonde,I miss my sweetie    only a couple more weeks though ,31
15042,Angelkc22,i miss my rock bar bad asses     KAAAAAAAAATE      ,31
15106,Angelteukie,i miss my babbyyyyy ,31
15143,Angharad_J,i miss #lost #24 and #idol ,31
15150,AngiHealy,is sad  My baby is on her way back to Ohio  We had a wonderful visit  but I miss her already   Hope to see her again in a couple weeks ,31
15270,AngiiJACK,@mikeykillsdeath I luff you too and i miss you  @LOCOroco Dannyy i loves you   ,31
15347,Ani3226,commin back to L A the fun is all over will miss New York ,31
15415,AnimalTails,i murdered my computer  I m not sure how i will survive now  at NW memorial with RS   phone is dead  Talenti lemon ice   so good   i miss my cat  i hope he doesn t forget who i am,31
15614,Ann7inFla,Hello Miss Ann in MI  Very happy to see you  too  Are you watching the playoffs  GO MAGIC    ,31
15619,AnnAnn08,im signing out now  going to read some materials   damn it  i miss mr  tootie so badly  tsk   I miss my Friends  I miss Joo and Bitches  @ tootie  Next time  I m Sorry   I saw Mr  Hips today  Im so happy  thought he was absent again   Going to study again   I m so damn tired  with the reviews  with the traffic  Good thing something takes away the exhaustion   Its nice to have something to look at while answering those practice test   A good view   quot Everythings Magic  quot  ,31
15639,AnnMarieDwyer,I hope a bug ate my followers and I did not lose them  @jhillstephens Who s from LA  I miss home ,31
15701,AnnaBanana0186,@josephdsummers   As lame as Jackson always is   I miss you too   I ve been all by myself for several days now  ,31
15756,AnnaEvans,I miss my awesome purple hair   @WillSpringfield I m in Philly right now  looking for an apartment  ,31
15811,AnnaMDurham,Going to my Aunts Birthday party and then saying Goodbye to Kevin for 2 weeks   I ll miss him,31
15836,AnnaMorganODell,Just stopped in Rolla  Trucking on to St Louis   Is almost home   @tammysatterwhit I miss y all too   ,31
15881,AnnaStrongwolf,@Snolly I lived in Athens for 10 years  I miss it   Haven t been back to visit in a while   I m hungry   And grouchy     ,31
15947,Annaaaaahx3,I m thinking people should not update their twitters before noon   It s not that I don t care or love her  it s that I can t stand seeing her like this   I m gonna miss her so fucking much ,31
16071,AnneFurballs,sec2 camp was awesome  I miss him  i really wanna figure out what s going on  on my mind right now  i really miss people right now too  stupid life ,31
16072,AnneG33,I am rather depressed today   It sucks  @paulkulp its not a friday brownie I miss them ,31
16174,Annemarie272727,Omgosh  I miss Teban and Dan so much ,31
16182,Annese30,Watching repeats of Girlfriends    I miss this show ,31
16223,AnniLovesToSing,@ddlovato what you ve been in germany   where you have been     please please answer @millelovespeace missing our voice lessons together  hun i miss you just dyed my hair darker  and watchin garfield haha such a sweet movie  watchin MTV Movie Awards  haha love it     one day    practising a presentation with my sweeties ronja  amp  svenja  @ashleytisdale wonderful that you ll miss germany hope you come soon again   cause I will miss your posts about germany   ,31
16295,AnnieRoseM,i miss the Soulja Boy dance     going to see Billy Elliot  ,31
16316,Annie_CAS,http   twitpic com 7hznc   I miss u LifeTime Fitness  I miss my lit tree  Rain   just in time for the pool party  Bloody mary s on a patio with my girlyz  DONE      after a little nap  ,31
16333,Anniebandanni,I miss Heath Ledger  ,31
16363,Annihilatian,Not looking forward to the upcoming week   My better half will be gone all that time  It s TRULY GONNA SUCK BIG TIME     Is there a way I can sleep for the next 8 or 9 days  That way when I wake up  she ll have returned  amp  I wouldn t have missed her SO MUCH    Well   The beginning of a VERY LONG week is upon me  the GF is gone with her family     Oh HOW MUCH I will miss her  Miss her already    This week is seemingly getting longer by the second   Someone please fetch me a sedative so I can slumber my way  til her return     SIGH  In case you re wondering don t ask   And now to find me something to eat   I never did find my banana     Ttyl Twitter ites  I m out 4 now I realize after my  quot hiatus quot  from work  that I TRULY did NOT miss the place  amp  definitely   My job SUCKS   SIGH  The GF I miss thoroughly   ,31
16386,Annisey,tomorrow  i miss you grandpa ,31
16447,AnolaGranola,off work  all day shift got me tired  home  wanna do something but sibs are here     it s cool i miss them too  @veejay08 im really sorry my love   so chris party is today   cnt go  waitng for dam bf  i think he lagged on me love   wish i was w  you and joe  i miss you  so now im hm  off work  all day shift got me tired  home  wanna do something but sibs are here     it s cool i miss them too ,31
16494,Anoud24,back from ROME   i miss the italian guyz    and my future husband cristiano ronaldo     ,31
16679,Antianeirai,@kimla310 Yeah I miss her  But she will visit often and I always want an excuse to visit LV lol,31
16851,AnyaC,Watching the Tony Award really make me miss home  more so than I already am  Very bad day at work  Tears were shed ,31
16904,Aolguin,so bored  schools out and i miss my friends   I can t wait for Demi Lovato s new CD to come out  Big Fan   I m tired  Godd night everybody   I just entered some drawings for J 14 magazine  I hope i win  ,31
16981,Apokalips, i miss you ,31
17042,AppleJacks0806,@mikecase omg I miss you so much ,31
17057,AppleWoman,Band banquet was pretty wonderful  I m going to miss all of my seniors  ,31
17099,ApproachableArt,Was going to see an Aaron Sorkin play today but I have too much to do at home  will have to miss the show and eat the ticket costs  ,31
17129,AprilDaydream,i don t want to function today   but i probably should  gah  yesterday sucked  and i miss alissa  today has sucked unbelievably bad  i miss alissa  tomorrow will be better ,31
17149,AprilLauzon,feels like crawling into a corner  and hiding under a blanket       you were just here  and I miss you already      ,31
17151,AprilLayne,I m gonna miss Marshall though   ,31
17186,AprilStorm,mhmmm zios was just like I rememberd so ready to go home I miss my honey ,31
17197,April_Slaughter,Is about to go out for all I can eat sushi    Guess what   Booking a trip to UT for 9 days in July   Yet another chapter down   that much closer   @Ghostology Hope the move is going well  Miss ya  @mikebrodycomic Not a thing  Mike  It s the best  and I love that my kids dig me  ,31
17219,Apriyaa,My teeth hurtt  hmm tired i miss new york   cant wait to move to new jerseyyyy,31
17268,Aquee03,Out of town and I miss my cell phone ,31
17291,ArabelaLai,I miss you too ,31
17296,ArabesqueBaby,Just put all of my precious fabric in boxes   Ahhhh  I miss it already    ,31
17314,AraleeJane,@cocol8y miss you ,31
17327,Araquilla,i miss him and always do  aaaaaaaa    miss you albert    what an awful day    got a lot of problems today    n people seems like couldnt be a little friendly  sucks,31
17467,Ared13,gonna miss the nonchalance of the drum tower quarter ,31
17568,ArianaMufson,thinking about how much I miss my true texan lady Brandye  who really needs to call me   ,31
17576,ArianeAstraea,http   twitpic com 6irxp   eating take out sopas from jollibee inside the car  Poor  poor me   what s happening at the finals  sux i cant watch today  work it is  i miss my computer      i miss my baby  i miss my sister  i miss sleeping in the morning  i miss cheetos   trying out twibble  Think it sux  @Jojami ah lemme see still making total recall  dont know kasi if i aint hands on paksyet try searching help hahahah http   twitpic com 7paqr   dinner at fort supposedly  so ended up having siopao and black gulaman at chowking instead  sigh  @Athena Aztrid yeah  like i said  once they start  it ll be like a swarm of bees na naman  @athena aztrid checked mail sadly we all agree anyhoo dont u just love tweetdeck   i wanna get iPhone n rid me of this iPhong already  @Jojami yeah sux  no   kit just called said he s stuck in traffic  so chuk chak naman the parade ackkkk  just saw my man coby bell on csi miami  sweeeeeeeet    i miss him  @jill cv at candon city dear  business  on a sunday  on a sunday   @Jojami ay naku  candon is so magulo  esp  the tricycles  tsk tsk hmmm business LOL @kassandrafranco hey babe  what did u do today  anything special for summer solstice  i miss u  @athena aztrid my effing chat client keeps on crashing  paksyet  @jill cv so you re finally tweeting huh   just thinking     i hated soderling s inconsistency  fed deserved this 14th title ,31
17584,Arianita1,@backstreetboys  Peru miss you  ,31
17586,AriannaBond,@TwoTheFace  I had to go buy some chips after I heard that     Miss you,31
17622,Arieder,@Virkus Duck   this makes me miss my duck ,31
17795,Arkansaslegs,has one child in California and the other in Kansas City   Sitting around wondering what to do now     I miss my kids ,31
17845,ArmandNoUsagi,Chillin on my day off   I miss my lil sis ,31
17859,Armenopoulos,@ SpunkRansom miss chi i dont know how to use this site ,31
17947,ArpitaB,Am gonna really miss this place    Call me geeky   but am even gonna miss the code     @sudhavr  @DG606 Well into Monday evening   doing not so bad in this part of the world ,31
18079,ArtiAbsinthium,You know what would make my life awesome beyond all reason right now   Bosco sticks   I still miss Lum s   ,31
18088,Artifis,@Jesssel Aww I miss you too  Yesterday me and Fred talked about you  I made him put a JB cd in his car  By the way I have a surprise for u,31
18143,ArtsyCatsy,@HotMBC  Morning  Hotties  Our mom caused us to miss the #pawpawty  ,31
18148,Artsyboo,I miss Luther     http   blip fm  742gu,31
18190,Arvuitton,Where s lexi    Please curve the damn test      @aibeengi me too   Can i please rewind back one week   Fuck   i miss him already  My room feels empty now  @aibeengi awww      drop count 1   Come to my salon for bangs  bangs  and more bangs   Bleaching hair  2nd time  hoping for a really light blonde   Everyone im meccamee is bored   Thats so funny haha   Aw i do miss everyone already ,31
18205,Aryaknight8,dude i miss watching the girls next door     ,31
18238,AsHl3YaMused,Hangin wit my faggots at dnd imma miss them ,31
18270,Aschlee24,I miss max already    ,31
18306,AshAtrocity,just got back from Monette  I miss it now   Dunno what I m gonna do now ,31
18357,AshGraham,Spent the last hour or two looking at old photos  Some of those times I definitely miss   @kristycolley Aww  thanks  And I hope you feel better  ,31
18409,AshPut,Just spent the past hour looking at pictures of me and my daddy  I miss him  I think I ll make a collage  Does anyone believe in ghosts ,31
18410,AshRagutero,Nazzy s retiring at 35  They should put up Naslund s #19 jersey up at GM Place  We ll miss you Markus  #Canucks,31
18444,Ash_Bennett,woo  won 8 ducks on a lottery ticket  boo txt twts arn t working again  Its nights like these when you find out who your true friends are  Love ya steph  I m gunna miss you major ,31
18450,Ash_Dawg,@taylorxparham i miss you kidddd   haha,31
18464,Ash_powell,once again I cannot sleep  @beckyg2319 BECKY  i miss our poolside drinking from last summer  and why haven t i seen you since I ve been home    ,31
18500,AshbaFanTasy,@chrisluvssixxam miss ya already     ,31
18515,Ashbythesea,Busy looking for a J O B    I miss Waco  Never thought I d say that but    I can t wait to come home again ,31
18522,Ashdled, sigh  i miss my ex    sigh  my stepdad his kid nd my mum r watchin TWILIGHT ughhhhhhhhhhhh  tha books r better,31
18527,AsheWennydaPooH,@dopeboi @missbriedidit HAD SO MUCH FUN            I MISS YOU GUYS ALREADY         @dopeboi awww miss ya already  @GCODEGFB @TyDrivenMusic fa sho   like the Beach Boys said  quot  i wish they all could be california girls quot   @paperboyfabe damn the W was poppin huh  @dopeboi cant wait for miami tho   Gotta get my g string bikini for the beach  @MCHammer Yea she s my choreographer and my HOMIE    LOVE HER   She has stories for DAYSSSSS about yalls tours   Thanx for hittin me back ,31
18542,Asher_Smasher,Palomino s tumor is the size of a baseball   had to bathe him and cuddled with ratty for a bit   I m gonna miss him when he s gone    ,31
18573,AshhMichele,Sitting in my hotel roommm  I miss Kellan ,31
18581,Ashhjade,i miss the nice time with you i miss the time that everything whas oke between us  what im trying to say is im just missing you    ,31
18644,AshleeKIOZ,Sighhhh  I miss my precious puggle Sami  i m just about ready to go home   Hiiii laughing man  Onward to yoga  so that I may center my soul  ,31
18674,Ashleeey25,@jenyourfantasy I wanna go   But idk yet  @walterestrada stupid stuff  kinda complicated  i miss you  @melmel391 oh ya I can t go  ramis thing is at 4 30 I miss them so much that it hurts   @JOJO1124 that entire cd is just aaah  Is watching The Doctors ,31
18726,Ashleigh_Dobbs,3 53A M EST and I m finally packing for my 6am train  Gonna miss Twittering    ,31
18727,Ashleigh_Duke,Miss my Mum lots  she is in Spain  im flying out there on Saturday   but i miss her  x,31
18743,Ashleiighhh,grrr twittter wont work form my phone  bedtime     i miss the boys  yuck i have the flu  ,31
18745,AshlessicaCrew,Jessica missed the show in Perth as well  Hope she ll recover from her back injury very very soon  We all miss you Jess ,31
18768,Ashley611,@mhmlauren  i m not in the city yet  we re going tomorrow  I ll take a picture of the city just for you and text it to you I miss the city and Toronto  I miss you so much  Figures when I m back home I start having bad days  so much for an amazing summer  I haven t talked to my best friend in like a week  I ve only had two good weeks this summer  I m just ready for august and october 9  oh  and i miss you ,31
18860,AshleyEccentric,I feels soo much later then noon  Ahah  On the beach  waitin for Jer to get done bowling on the other coast and come home  I miss him  I ve been up since fuckin 2 14 and I hatee it  I want sleep  I want jeremyyy to hold me while I sleep  Stupid teenage cravings  im sitting in Johnnys room texting Bill trying to make him happyy  @buckhollywood oh no  That can t be posible  Your depressed vagina just made mine sad  hahah Just homeee  I wanna jump in the shower but I m not sure I have time  FML  Cook out thing today at Buddha s  I get to see Jeremy  lt 3 I miss that family so muchhhhh  I miss my 23 year old buddyyy  but oh well  I still k i t  with his cousin  ,31
18877,AshleyGarza,@tylerhaganME Yes  Yes it does  i miss my other home    ROCK IT TODAY   doesn t feel good   hope i didn t bring a mexican flu with me home  @AngelicaPrado when are you getting your new do  i got mine today  rojo con blonde s  no bangs i like em long now  i miss u bunny  my little bro graduated ahhh  so proud of him  Checking if twitterific wrks on my phone  Goodnight finally  official countdown for PV   T Minus two days   wooo ,31
18892,AshleyHoyer,@IamTam @keamo03 @OvhII miss you guys  Lonely in Springfield  ,31
18934,AshleyLancaster,Miss the boys already @davey15 @marcopolo15 @daveyf15  mostly @breck15 I m finally home  Weekends are my fav   Wish all the boooys were back in tooooowwwn      Miss mah baby   @breck15,31
18984,AshleyMixson,@ashleymshep yeah girl you betta be on twitter  i miss you  jealous of jen s limo ride ,31
19034,AshleyRyan22,Worried about dawnald     Great great night  Ready for bed  Waiting for juno to get the Fuck off the couch and take me home   @dawnykhao   i miss you too  where did you see him  I m at his old house    @dawnykhao  Aww i totally miss him  i miss you too I just love how i get to sit at the mall for hours   even when i m not working   what a lame ass Pretty much the co at my store for the next week or two  i miss austin already  Had lunch with Paige  i have missed her so much ,31
19078,AshleyVeronica3,@kbayybayy I miss you     u drank without me  @kbayybayy we are hanging out asap  I miss you     My phone was dead all day and night    saw ur angry twits   I ll Kung fu anyone for ya @kbayybayy little missy you stopped texting me then I text u then  you text back but yeah completely forgot to text back   love you tho  ,31
19089,AshleyWonders,@MollyMae1204 I miss you too   @MollyMae1204 I know  I hate it too   We need to talk more  I miss my best friend ,31
19092,AshleyZ007,i miss vic  he needs to come home soon   ,31
19166,Ashleygigglez,@DJWebstar sitting @ my dinning area table    And Gavins in GA    miss him,31
19189,Ashleyrox101,i miss the girls aloud concert  xoxo todays our last day with meggie  gotta make it fun,31
19214,Ashleyyn4,Jealous of everyone of my friends at sonic  @Evilpaintball i m jealous  @KelssBeautiful I really miss you ,31
19217,AshleyyyNicolee,R I P  Shawn Nonnemacher We all miss you work isn t the same with out you   home and texting ,31
19264,AshlynZare,Taking daisy to the emergency animal vet  poor Dcom  @MaggiieJonas I m so mad   I had to miss it    atleast it s on record at home,31
