,username,tweet,cluster
31417,BriKH,Setanta made me miss Liverpool s second goal  grrrr  Anyways  Good goin Kuyt  ,31
31448,Bri_Cooley,Sometimes all you can do is pray    heading to the emergency room to make sure my mom is ok       I can t see the live stream of my church     Imma miss my blessin    WAAAAAAAAAAH ,31
31485,BrianDeAug,@Mileycyrus miss you  Im in Wdw watching hannah on my laptop   cant wait for the movie on bluray ,31
31489,BrianDruma,andrea s phone died  she s at aprils and now we can t talk all night  Ugh  i miss her lovely voice so much   lt 333 i love you andrea   I miss andrea so much lt 3333 it sucks he phone dosen t work anymore  i would call her lt 3 but she is sleeping  and she needs her rest  ily andrea  ,31
31514,BrianJSell,@miacarruthers Awwww  that s so cute  I miss her very much,31
31566,BrianUnplugged,Somebody buy me a plane ticket home   I miss my girl     My throat hurts and we still got 4 days left ,31
31655,BriannaDinsmoor,I MISS ALL MY FRIENDS        I WANT TO GO BACK TO SKOOL FOR MY FRIENDS ,31
31666,BriannaPanza,I had an amazing time with @alexaann last night I miss you already ,31
31787,BridgetNicolex,Ugh really    I needa figure out where zakk and john are  I miss muh boys ,31
31798,Bridgetbrately,@NRMcclelland  miss you  loveeee this rainnn   out with @NRMcclelland @devinxrhodes and michael ,31
31802,BridgettElliott,@AllieOGrady i miss playing mario party with you ,31
31819,BridgitJRP,missing people   goodbye league  im gonna miss u ppl   ,31
31821,BridieBunny,Last day  O I m going to miss everyone soooooo much  @tinalouiseUK I know it was a lot of fun  3 I love hanging out with my Auntie Tina ,31
31841,Brielle5188,I miss @Cccccatie ,31
31907,Brii1017,@ShoeGirl21 awwww I m a get to see lari more  I miss her  ,31
31975,BrisVegasChick,aahhh i miss playing with my legos         when i was a kid   via @Muzzzza  Don t be missing it  go out and buy some ,31
32092,BritneyElder,@LaurenConrad missing audio on the West Coast too   It s ok tho  still an awesome show  We ll all miss ya ,31
32165,BrittE2,In Belmar to see some best friends who I miss so much  and Happy 21st B Day to my little  lt 3,31
32307,BrittanyGiron,I miss ya  Boyfriend   When am I gonna see ya again  Br Tt@Ny   ,31
32396,Brittanykins,Eating my last lemon cupcake  I M ON THE PLANE GUYS  Turning on airplane mode though  Bye  I miss Supernatural  Just landed ,31
32481,Brittneyy18,@kathryn 775   Lovee youu  I miss youuu bunches  just finished watching Marley and Me   such a sad movie  ,31
32740,BrookeBR00T4L,Is doing nothing D  lets make plans   Imma miss Zack while he s at summerr camp    ,31
32764,BrookeJillian,Leaves for florida tomorrow  but will be down there for 3 weeks  im gonna miss all my friends ,31
32960,BrownEyedGal27,@ddlovato i missed demi s tweets more  haha x  jk      i miss my mom  @ddlovato DEMI      I JUST TOLD YOU NOT TOOOOO  gah           @ddlovato doonnttt doo thiss to usss  we are just helpless stupid fanssss  Going to Stephanie s house with elsi dora and viviana    gonna miss maggie  @ddlovato My voice isn t doing so well either  but fortunately i don t even have to use it  unlike youuuu  lol  i ll pray   ,31
33155,BryanBoudreaux,@jamieorillion dude I hear you are moving home    i am gonna miss you ,31
33273,BryonyBarker,has just landed in LA yayayaya dont miss England at all    only here for 2 weeks hol tho ,31
33344,Bu2ful_Asstnt,@djcommish @JuneBug143 Awww hey boo    i know i miss all of them   @jkilla1780  thanks but I m still in NY   I have another client I work for who s an actor so I m still here ,31
33425,Bubblez686,I MISS MY ROOMIES  Worst week of my life  THE YANKEES ARE BACK    ,31
33605,Bugzbunie,mairead left work 2day  was so sad  miss u staffie  luv ya  xxx,31
33647,Bullpigology101,@Bagakk you signed off on me  I miss you @Marquann omg dude  I forgot  I have to go to the orthodontist soon  NOOOOOO  I might have to get braces too   I forgot all about it    ,31
33696,BundySpeak,@lindseypena heyy  I miss you too  Yea i ll let everyone know you said hi  Or better yet  i ll convince em to make a twitter ,31
33762,Bunpan,Been in FL since memorial W E  great relaxation  Looking fiorward to going home next week  miss yaad bad ,31
33791,Buried_Black,Wants waffy online  this aint FAIR   miss  you ,31
33816,BurningPriest,@alexalbrecht Are you gonna be doing a new ctrl   alt   chicken type show  I miss CAC  ,31
33820,BurningUpLover,haha he don t want to take a picture with me buu  @ShhSandy  waa no no no i m gonna miss ya a lot girl   whit who i m gonna talk about the jo bros  or miley taylor  with who  just with u i feel so stupid  jumping on the rocks    8  route 66  itzel and me ,31
33918,ButchieWizard,Dad I miss you  ,31
33939,Buttas104,is absolutely exhausted   I miss Samson ,31
33961,ButteredBisquit,Missing and dreaming of the Coffee life  I will miss @barefoothillary this weekend  ,31
34017,ButtersAndEggs,Ah  back in #Boston    I miss #Brooklyn already though  Back at pratt campus  So weird  but I miss it  #pratt,31
34029,Button_Button,aw    i cant believe everyones gone home for the summer  im all alone in grove now till the degree show and i miss my keke already  is a little down right now ,31
34098,BwieBhalt,I miss you  ,31
34252,CAG79,Great  my car broke down  It might the starter  Remind me never to buy american cars again  I miss my Mitsubishi Eclipse  ,31
34278,CAMILAVIANA,i gonna miss you chin boy  oh man i REALLY GOT TO GET OVER @tommcfly ,31
34298,CANREMIX,im so confusedddd      but feelin  great today    thought about an person and i miss her allready ,31
34428,CBRfanatic,Searching for the best #blackberry apps  I miss pirette ,31
34475,CBrooker,@angielim Twitter is still broken for me  mostly  @casiestewart It s not out up here  I miss the sun  I left my lunch on the counter at home  Everything will go bad  It s going to be one of those days  @kirtl ahh  we re drinking at the Don mills Jack s of you re still bored ,31
34560,CCoop10,@Jordynlovee I miss you toooooooo ,31
34635,CELEBSIDEDISH,@LittleGigiGirl Ahh  Well  little miss tweety bird  It was probably for your own good   Glad you re back ,31
34640,CELTICS_LOVE,@TheRealJordin i cried at that story at the half   all i can think about is how upset he must be right now   @KimKardashian its sunday and your show isn t on  i already miss it haha can t wait til ur sisters show    will u be making appearances ,31
34663,CEPodcast,I miss those old days when I was still majorly obsessed with Disney Channel  I obviously don t like it as much anymore now  ,31
34685,CFP_x,The show was great last night bit stressful tho  actually a bit sad it s over tbh  @Lauzzaa I MISS YOU SO MUCH   ahhhhhhh,31
34706,CGHplusBMJ, being told im beautiful doesnt make my tummy better I miss my baby  Why isn t he calling me  Missing my baby and wishing I would ve had the time to talk to him earlier   now he s mad at me  Goddamit     ,31
34773,CHARMOKE,I miss eating gushers  playing monopoly ,31
34851,CHR1SwasHERE,sad face  i miss someone  no1 wants to go to the gym wit me   ,31
35014,CJisbehindyou,Classes begin   tommorow    SHIT  I l miss freedom    ,31
35049,CKhemani,At honda ya again with @ksachdeva1   Can t believe I am gonna miss the parade tomm ,31
35174,CMYKiller,@JoyBethxo well I am hoping the manager is still looking out for an opening  I miss our early zombie mornings  ,31
35247,COBHC1121,@KManCOBHC No SC either     I miss you dudes ,31
35248,COBICOM,@letiitaa yeah i know  i miss u so much  snif snif,31
35266,COLiEPYTHON,I miss derek  And i cant stop thinking about him   is in NYC until Sunday night  i ll update this through my cell  text me   TURNED IN MY SENIOR THESIS A WHOLE DAY EARLY           ,31
35380,CROOKlin,i miss going to shows  in Petoskey getting things for Britt s wedding ,31
35390,CRUNKRacoon,EAT starting soon in actually going to miss this  Burned my hand  Smooth move ,31
35397,CRYSTALASIA,The things you dooo makes me keep runnin to youuu    member that classic Bad Boy sound   I miss that     ,31
35672,C_Julie,Back home  pretty drunk     Great night out with my girls  I m gonna miss Eric so bad   ,31
35745,CaRRieBeaRy24,@bfree47 ya im alright   i just miss my car  thanks ,31
35752,CaSami007,Loving hulu  maybe my funky hours wont make me miss  every show I ever used to watch now   ,31
35774,CaarH,@jezajonas I miss you much ,31
35782,Caarols,@tommcfly so unfair            @tommcfly i miss you so much  tom     it s a horrible feeling @tommcfly it s awful to say goodbye    ,31
35854,Cadence911,It has now reached 91 9 degrees in my workplace  well i survived vbs  i am very tired but i will miss some of the kids that came but does not go to our church ,31
35859,CadieTaylor,@BrittSmithh I miss those tuesdays  Please come see me like you promised ,31
35892,Caestellase,i never wanted to be ur ex besties I wanted u be my besties 4ever   polkadot seriosa ags haha  I miss you all    i never wanted to be ur ex besties I wanted u be my besties 4ever   polkadot seriosa bdah haha  I miss you all   ,31
35932,Cahmonteiro,BEST      I MISS YOU      ,31
35943,Caiitttt,crying my eyes out  i miss my best friends already  wont see them untill aug  on the train ,31
35972,CaitArsenault,who knew five months ago that i d come out here and leave with three new best friends   ill miss you guys ,31
35978,CaitDog,Hope this week won t be as long as i think it will be  I kinda have a feeling It ll suck   Well  @tyyylerr i haven t tweeted you in forever   I want a cheese dog on a stick   Soo  i miss  Boy meets world   @sisirverduzco you Meanie   Haha ,31
35988,CaitMurph,Got some sun today  I ve been thinking and I miss Tori and Sarha Testa   About to watch The Hills FInale and MTV Movie Awards ,31
36073,CaitlinMorrill,hmm  getting sentimental  this sucks  i miss u guys already  @JessLeighJDM ahhhh your pic is so cute  I miss you and the brodster  im coming to visit you asap   beach was amazing today  im still not tan though  FUCK  but it was a lot of fun  im gonna miss you B  just did the first flip of the season on the trampoline  LOVE ITTT ,31
36182,Caity_babe14,i miss justin      ,31
36406,Caligrl34,@sabaksh heyy girl  i am going to miss you soo muchh   german was funn ,31
36494,CallieKayRead,Over the jon and kate bullshit  Lunch with jack  work and then midnight showing of Tranformers   I miss the boy a little  ,31
36578,CalvinSutton,is PISSED off the LAKERS WON lt    BITCH    and i miss my babe ,31
36604,CamCat,Walking home in the clear summer air  listening to The Veronicas  Reminds me of how much i miss last summer ,31
36694,CameronKilgore,TwitterFon is not working   But watching the Softball College World Series  Hoping Georgia wins this game  Florida will win it all though  I miss @itsJKeith too   Done painting for nowww  ,31
36759,Camilaaaa,@tommcfly I would like to be in that bathroom   Hey   i miss you here   in Argentina  Come back   Reply to me   you never do it ,31
36784,Camillaanne1,Finally healthy again  I miss you so much  hope to see you soon   Summer is definitely on its way ,31
36820,CamitheLami,@jaymayyyy aw jamies  i m going to miss you too   p s  i still haven t packed  Out to fuji sushi with joey  what makes it even better is its free ,31
36920,CanadianTerry,WOW i can t believe candice got released  Her fans are going to miss her ,31
37023,Candicehorta,@greenmonsterpoo My little bee    I miss youuu ,31
37084,CandyElizabeth,I miss the sunshine ,31
37375,CaptainTay,It was sad  I miss my baby boo  i miss my baby boo  lame    Im not even there  I shall they said thats funny   youre the red bull guys  meeting you was fate  becoming your friend was a choice  but falling in love with you i had no control  over  Who else can rock cookie monster   my baby is amazing Just rode bikes to mcdonalds with coral    So worth it  Just saw UP ,31
37411,Captivated_,@drealoveslife i miss you already  so sad that i didn t see you after the show anymore   it was amazing  how close to the stage were you  leaving in few hours  I m gonna miss Amsterdam so much   @deedeedet i know  i need to get their cd somewhere   hopefully they sell it here in finland  ,31
37429,CarCarDee,@Playwithinaplay and we both have twitters  yayyyy  miss you already  when do i get to read your novel ,31
37550,CaramelKisses2U,I m def havin an i miss my brother moment   but then again i have 1 of those evryday so      Ga heat horny no man one bad night for me   Lookin too fly to be at work right now ,31
37559,Carasaurus,I M FREEEEEE  I ll miss the wgs though  Nooooo my J turned into an L  I m gonna be at civic center forever ,31
37601,CareCon,wellll Welllll welllllllllll im going to miss the sunsets the next two days ,31
37739,CaritoTang,@johncmayer please  can yoy say me  what time is it there  i have the pic winner  the tatoo my friend is sleeping in this moment   i m going to stay in my home   i miss my mom     Gossiip Girl  the best   the last episode next week ,31
37908,Carliss11,@Kristeella hey girlie miss u too u gotta come to our girlie night whenever we have it ,31
37932,Carloboscan,Woke up   Just watching some tv   on demand always gives me something good    I miss fattie  ,31
37935,CarlosCSilva2,I miss peggy  Gonna cut my wrists with a spoon  S,31
37958,CarlosSaldivar,@pamelatyll can i see that online   its a BEAUTIFUL day  i miss my peeps from austin  wish you all were here  @melindajane @pamelatyll @sambruckner and you too  mmm i think lunch in chipotle sound delicious  although i miss freebirds  well hello my tweeps      time to work hard     first  some coffee  how was your weekend   @pamelatyll jaja i say you should go get a venti  iced coffee  sweetened  with milk  that  my love  is perfection  ,31
37994,Carly715,take me back to europeeeee please       i miss all my friends ,31
37999,CarlyAnna487,hates goodbyes   i miss my long hair    ,31
38202,CaroTheNyx,I  seem to have a small headache and ugh I had a dream about my exbf and it sucks   gosh    @TrixyFirecrackr btw it s almost 4 am here   lol    damn gettin it from someone right now  damn i guess im not sleeping tonite with these texts    @Ms Thumper Uhm I don t do that shit  that s kd  But fine  I don t want your number        cries to my corner  @Lil Miss Kinky  I wish u were awake I need u I feel like crying  @Ms Thumper  @TrixyFirecrackr same here      @Miss Foxay damn baby uh why you such a perv    Child molester    Muahs I friggin miss u I messaged u in yahoo nvr responded back  @MdmPoppyFields lmfao im sorry but that was hilarious  okay Sims 3 is pretty addicting    sighs like a drug    @Miss Foxay Everything will be alright so long as you ve canceled your accounts becs  don t worry those wankers will get whats coming 2em @Miss Foxay hey where did you go   @deviantcuppy hmm  ouch @ the fact that you haven t missed me     Well  fine  uhhh    errr hm      Jebus  ,31
38216,CarolAvila,@annamessias i miss yoooooooooooooooooooou my poia  @annamessias i miss yoooooooou my poia ,31
38227,CarolG1346,i m having a supre bad anxiety attack  i m suppose to be to work in 6 hours  i can t sleep at all  i miss my boyfriend  ,31
38305,CarolinaMusicc,i miss a teens ,31
38306,CarolinaNakao,i miss you too      stuuuuudy  SHOT  HEADACHE  HEY  how are you @GrabeelLucas      SHAAAAAAAAAAAI LEBOUFF  HAHAHA  having fun with isabella ,31
38339,CarolineChase,I miss everyone up in Whitby ,31
38400,Carolinnaaa,I miss you ,31
38417,Carolyn729,@Jujio I LOVE chai   I miss our tea parties  too   What s your schedule like the next few weeks   I could come down and visit sometime  ,31
38563,CarriedByWaves,Bummer gonna miss free Stevie Wonder show at Montreal Jazz Festival   Enjoying the wonder of delicious homemade hummus  ,31
38620,CarterHarris,Today was my bosses last day  im going to miss her  But i heard through the grapevine that she wants to take me to her new store,31
38663,CarylMarie,@landielove word up  I feel u on the drunkies in the heightz    I miss those days ,31
38666,Carylsixx,@TheMrsNikkiSixx  We ll miss you  #Sixx  @irishjenny  It s been over 24 hours   Where has JM been   I miss him  @7angela7  Sounds nice going to your parent s   I sure do miss my dad  @7angela7 I sent you a MS Message   They were having problems yesterday with following  blocking and such   Thought you were made at me  @chrisluvssixxam Thanks  think I might just do that   There are 4 other local bands w them   Should be good,31
38696,CasanovaJSandy,@StarfishDanehh  go to bed   you left me like hrs ago LMAO i miss Joe  @lil miss smiley  I know  @MariaBernal  both  @arwatts Turn right   Hey baby  Black keys  World war 3 ,31
38727,CaseyBrianne,God I miss her and she has no clue how much   I m too afraid to lose her friendship to push it any further   relationships suck,31
38800,Caseyy_,Just had to zap my horse a few times with the electric fence    not pleasant  @jillyxxxcunt Nathan   @miss hazy Bahaha travel insurance  That s awesome  Poor Robin needs to get better  @miss hazy Maybe I ll get them to sign my plane tickets in Singapore hahaha  I love the idea  Trent is mean  The poor thing needs sleep   @miss hazy Ohh  that s sad   I love flying  @mAtt7X He s a horse at work      long story  but he wasn t looking real good at all last week  @MickDeth I miss 18V  Alot  I fucking hate the rain  Yay  rain again  @jeremysaffer Fuck youuuu  @Screamingslave Thanks    Sleep well  and enjoy the show   @robinfincktwits Are you feeling better  sir  ,31
38802,Caseyyyyyyy,i miss mike already      i never knew my nephew liked the beatles  just started reading twilight  can t put it down ,31
38900,CassandraMouco,Europe next Tuesday  guh  Gonna miss my B   lt 3,31
38908,Cassandra_Miles,There are so many things I m not sure of in life  but with all certainty at this very minute  all I know is that I miss him  Enjoy London ,31
38982,CassieBrahh,Still haven t slepppppt  XD Just dropped kasey off at work   At caleb and josh s watching the dark knightttt nigga  Kaseys workkk stole him from meeee   Playing computer games lika n3rd  I missssss my baby  I miss my boyfwend   Bedtimeeee  Still miss kasey a lot  I miss my boyfwend  Bedtime soooooooooon  Showerr then calebs wiff kasey  Shower  Bored  Then kasey  Kaseys workkk stole him from meeee   Playing computer games lika n3rd  Get to see kaseyyyy soon  Laying wiff chelkoon waitingggg ,31
38988,CassieDonnelly,will miss vision meeting tonite at church   Gotta work   Hope all have a great day ,31
39000,CassieJade,flight j got in   i dont wanna be home  anyone keen to fly away with me         handed in my uniform today   i miss you already 7TH  solid effort hahah,31
39015,CassieMitchell,I miss my internship    @wthrcom ,31
39016,CassieMo,Lack of community  a lonely Cas    I kinda miss camp right now  ,31
39137,CatBlogosphere,Our furriend @OscarTheCat went to the Bridge http   is gd KJms  We will miss him ,31
39181,CatMumm,generally loves it when Miss Tatiana shares   Not so much when Miss Tatiana shares her nasty respiratory infections ,31
39332,CatheSaxon,Wolverine was awesome  Back to being a jail bird     LOVE getting gifts in the mail from my very wonderful friends back home   How I miss Myrtle Beach so much    A little homesick today  @LindseyBrooke  No one is going to be there when I come back ,31
39361,CatherineEHarri,@aaronleder  I miss you guys  And L A   ,31
39407,Catheriya,@NickZappia oh good  Johnny came over  I miss him ,31
39429,CatholicHeretic,Texas beat So  Miss  too bad ,31
39611,CatyH,i miss my baby  feeling lonely ,31
39618,CatzMeg,Hi  I can see you re reading this  STOPREADINGTHIS  @FlashFerret We Love Youuuuuuuuuuuuuu  And miss you to ,31
39635,Cavalli_Cali,@Miss Holleewood ive been told it fits me mi amore  @Nay Lo i agree ,31
39768,Cccccatie,@SONofWRONG I miss our party times ,31
39913,CedwardPattzum,@alexishrawr     duh i miss you     i miss everyone,31
39992,CelaMaria,So sad I m missing the marathon  Miss you guys  @esdi YOU ARE THE CHAMPION  MY FRIIIIEEEND  YOU KEEP ON FIIIIIGHTING TIL THE END   So proud of you ,31
40014,CelebrityLin,I miss my boo ,31
40028,Celennys,Sad   He s gone   Won t be seing him for another 2 weeks     I miss you too papi      @G3tfly aww thanks baby  Love u and miss u    Ima try to have fun but itd hard since your not here  Back to the BX to Packk ,31
40042,CelesteMaisel,I m going to miss Burning Man so much this year   maybe I ll go to Soulstance   Has anyone else gone to that   Is it awesome ,31
40123,Cellee,i miss jelly bread     makes me smile ,31
40168,Cely_H,with all of my family  daddy  i miss you  @ameriicaa Laura  i love you  amp  i miss you so muuccch  lt 3  @Ameriicaa i miss u too  une soudaine envie d   couter  quot your call quot     Soan  amp  Camelia  lt 3,31
40179,Cemre_McLean,@backstreetboys  sigh  absolutely      Although we ve  never seen you face to face     we miss you so much  ugh    pls come to TURKEY   @backstreetboys  sigh  absolutely     Although we ve never seen you face to face     we miss you so much  ugh     pls come to TURKEY   @backstreetboys  sigh absolutely     Although we ve never seen you face to face     we miss you so much     ugh    pls come to TURKEY  ,31
40293,Cessy89,Oops it s upside down  @ame114 i wanna come with        miss ya,31
40294,CestyBaby,I miss Sean ,31
40354,ChOubidOux,@TaniichOux I miss you My Darling   I love you Best friends  L    You and me that s the life   You re my life ,31
40489,ChaireeGirl,just finished pretending to be Fanta Girl while singing in the rain and riding a Cat Tran to nowhere   I m going to miss Tucson ,31
40547,Champ502,3 More days   I m going to miss Mel ,31
40582,Chana009,I miss my best frnds   cnt my cusin cum home 4 just 1 wk  hehe,31
40588,Chanathan,@5OH7 is going to miss the Lebron Kobe puppet commercials   Is going to miss the Lebron Kobe puppet commercials   @jbondjr good  I m all about the Lake show  @xarxa they can implement it w  a seti@home skin to make  it feel more worthwhile ,31
40591,Chance4Shizzle,about to get off computer     No phone so no text are needed  Ugh   Future you tube star  Almost homeeee  I miss my Ray hoe baby,31
40629,Chaneee123,RIP Arlene Mcgrath  I miss you so much xoxo ,31
40695,ChanielAndran,I m going to Miss Jay Leno sooooooo much  Heading back home from Six Flags  without my Camera  Awww 5 min till my Birthday Endz    great weekend I had with friends and fam  I can t wait for my Rooftop BDAY celebration on SAT  Party TIme,31
40856,Chaqlat,Mii tummy is hurting so babdly      @itboiz y thank u baby    awww i miss ya hair ,31
40906,Charbotta3,I miss my sunglasses    The river ate them up    Charlotte is sad ,31
40933,CharismaCH,@alydenisof  alyson my love  i MISS YOU  how is Alexis  How s the baby  Aww me and Damien miss you guys so much  @SamanthaC2C thats awesome  Tell you re boss that i m totally flattered and that she s adorable  Tell her to embrace the name  ,31
41013,CharleneLori,@theofficialdani you need to come back to tv    we all miss you ,31
41250,CharlotteFate,I BADLY MISS THE US ,31
41403,CharneseV,@MissEWillis Miss u too love  U fell off the radar   ,31
41417,Charr_jane,I miss steel panther dude  COME BACK,31
41459,ChasedbyBear,It sucks when you miss someone do much ,31
41539,ChaunteLeBlanc,@abbylinne wtf are you doing  i miss you ,31
41541,Chauntellea,I miss Nick  a lot   And it s kinda ruining my summer ,31
41666,CheckYesNina,gosh  i miss toronto  when i heard Nick Miley singing Before The Storm  i felt to just cry   @nickjonas u guys are in Toronto  OMG     i always miss u guys when im there  come to trinidad  ,31
41669,Checkers_x,thinks tomorrows gunna be a long day  Cant wait to get it over with but really gunna miss everyone ,31
41739,Cheennaa,Haha I miss you too tia ,31
41763,CheeseIsYellow,Opa  29 03 1927   18 06 2009  I miss you terribly  ,31
41788,Cheetara101,@Corsette  I miss you too   I ll be home relaxing  amp  watching movies   ,31
41799,Cheezmonkey,I really miss her  it s been like three weeks since I saw her,31
41905,ChellaRoo,I just miss talking to him when niether of us could sleep and he would say it was okay that I missed him   cuz I really miss him ,31
41924,ChelleInLove,anyways  i miss 1st block  Well  I guess I ll let ya go to bed  @ReAnNaHeRe dang  I invited Andrew too  I hope he can come ,31
42116,ChelseaRiot,also  I miss my boys   my clothes need to hurry up and dry  I want to go home  ,31
42125,ChelseaTaylorxo,At work  blaaah but I luv miss k for making my twitter for meeeeeeee,31
42129,ChelseaUnicorn,well I am still not done    but I need a few winks     @howisurvive I miss you already  We used to be inseperable  lol @stoneybmac cause lol I miss you too   gonna shower then party at Robby s  @Duchesssamantha I have diabetes like Nick Jonas ,31
42229,Chelsie_Tang,Being made to go to dinner with the relatives  will cry if I miss the apprentice    X Watching the parent trap    Such a classic   X,31
42245,ChelsyHitomi,I miss my love ,31
42342,CherieBlossom,My computer is gonna be down till next week so minimal tweets from me unless I can sneak one in on someone s computer miss you all ,31
42399,Cherriepei,Miss my baby boy pretty much  Can t meet him for a span of time  cause he have to work in these two weeks of hols  IMISSYOU ,31
42413,Cherry0990,@nunu05 loooool   Ya the drama is fun   Just another ep  Of GG  p ahh I miss that show ,31
42730,ChiWright,I miss you  E5  So tired     @nathanieletc You should make one ,31
42766,Chibinese,I miss my ugly puppy ,31
42824,Chicagoboy19,@RileyRavage I miss you so much  @RileyRavage Probally not  ,31
42825,Chicagogirl1996,I am watching Ace Of Cakes and missing my best friend Brooke  The most wonderful thing happend today are car broke down   I miss my uncle Mark and his dogs ,31
42837,Chichoune,@NKOTB Hey guys we miss U so much we are so sad  make a full service tour in Europe     Kisses from France,31
42863,ChickenTalkBlog,RIP Birdsong Radio  We will miss you  http   news bbc co uk 1 hi entertainment 8076381 stm,31
