,username,tweet,cluster
19346,Ashxamazing,I wanna be with all of my friends right now   I miss them   The one I miss the most is Katie   http   twitpic com 6hjyd I miss Heather Costello   like    No one knows how much    I m going to keep doing sad faces   yep    I sure am    Blahhhhh   Wishing I was hangin  out with my best friend @Heathercostello tonight   I have the two greatest best friends in the world    Heather and Brandon  They are amazing  @ddlovato has alot of good things to say   wish to meet her soon ,31
19459,AspaGeorgiades,@marialola85 I miss T O too  im gonna eat all the twizzlers       S,31
19511,AsterHavok,i miss my phone ,31
19576,AsuMel,Backyard is finally getting landscaped   Only downfall is that I already miss Spudnik who is staying at his grandparents for a few days ,31
19723,AtomicSupaFluff,had a great night yesterday with Miguel   Josefine amd Amanda  WILL MISS YOU GUYS WHEN YOU LEAVE  ,31
19770,Attra7,i miss maine ,31
19823,AubreyStolz,Can t stop crying  I m going to miss all of the cbtv seniors  lt 3 ,31
19830,AubrieAyy,@MegDollXD I miss youu  They re home from vegas     ,31
19859,AudiFristya,i miss you too Al  i really miss you   P Created a look on looklet com  http   looklet com look 97084 my first looklet ,31
19894,AudraOz14,Ugh  I hate my body     Hanging out with @Humetewow and her grandparents makes me miss my grandma and papa more than usual     But it was FUN Seriously  EVERYONE is here with someone  Ughhhhhh  FML   @TrishTheDish i didn t see that one when i went looking   i was sad   so i ended up buying another one   @humetewow got damn black sabbath stuck in my head    stupid limewire takes forever   i miss soulseek    but i can t get it to work with my mac ,31
19941,AudreyWow,Romane  i miss you   I want a Smoothie    ,31
19960,AudreyyG,@JuliyetteC JUST I LOVE YOU  amp  MISS YOU      @JuliyetteC I miss you too my loveeee   I wanna see you    @LizzieSp Love this song ,31
19975,Audrinicole,wants to go back to church camp I miss it ,31
20092,AurelliMiller,@matromao Yes  Wherelse   i miss you ,31
20251,AustinRayy,I miss my boyfrann   ars  lt 3 s crp   This is why i never keep a relationship for long  i always Fuck up somehow  Cant sleep   Coty is all up on my mind  I miss him ,31
20266,Austinfftsm,I miss Kristi    I have a new favorite song though  ,31
20381,AvaAlcantara1,@DavidArchie Thanks a lot for visiting our country  The concrt was AMAZING  We miss you here already   Hope you ll come back with DC  watching Enchanted on Star Movies   @KrisAllenmusic Hey Kris  I m so excited for your debut album  Can t wait  ,31
20497,AvgAmy,@miss gato it sucks to make that realization about your friends ,31
20526,Avien,@artsangel Awesome update  but I really miss Petria s cap  It was awesome ,31
20527,AvigailClaire,Feeling shitty  Poppy just wanted to put it out there that I miss u already  @Samara B been tryin to call u for days but can t get through ,31
20542,AvivFreshDoron,Back from Rome  going to miss the great Cafe ,31
20553,AvonLady85,It s COLD out  No beach today  Ok    going to bed  I miss Leyla  I hope she can come here this summer  Hubby working late again tonight  I really hope harvest is over with soon  Being alone until 11 30pm is getting OLD  I miss my hubby  Hubby @btolly1244 just came home for dinner but is headed back to work now  I smooched and cuddled him a lot and now I miss him already  @arose4yu haha hey  I use Tweetdeck  Goodnight  I love my husband ,31
20570,Avster666,            Miss my love Jamie,31
20601,AwesomeArianna,@Cowgirl1011 I know I miss you on there  lol @FrickFrackGirl lucky  I miss thunderstorms  we hardley get them anymore  @LeighanneReena Brian left again   I thought he just came back  no one knows  ,31
20739,AyaToujo,Did I miss the full moon  I think I did  Awwww  I am still totally freaking out about my Acen Cosplay outfit  I m going to see if I can post a picture   ,31
20907,AzDhHo,I already miss my boy ,31
20950,Azima606,Awww lol we miss you too ,31
20958,Azizalaziza,@dAnggArris haha  How are you dear  Me miss you long time  ,31
20982,Azness,I still miss yall but I have to log off now  ttyl      lt 3 @RiseofStarman why did i have to miss your show  ,31
21079,B3CKTR0N,Sue s gone to AMSTERDAM   I miss Susan  Had a fight with Aimee  I miss Aimee  Were both minus one friend  I shoulda stopped  Too late now ,31
21124,BADAZZJAZZ,@ShyHillsz boo I miss u too  I go in the evening ,31
21140,BAFB,Happy Father s Day to any father s out there  To my husband who is an amazing father and i miss you daddy   Its been 11 years  @Spinlj  MOOSE ,31
21152,BALLADofEUGENIE,@tommcfly I m listenning to this one to   They were just genius  Miss them ,31
21198,BATHROOMSEXXX,Thinking bout 2marrow won t change how I feel 2day    @mattandkim kinda  imma miss @essandbee video shoot such a sweetheart style on bee      ,31
21214,BAmiLerA35,miss my cous     kiara ,31
21221,BB0127,Mary my friend I miss u    ,31
21264,BBQmommy,Apparently food colouring is not oil soluble  Failed science experiment with Miss E this morning  Little man was up all night   I am exhausted  Miss E has determined that mom is not cool to kiss on the way to daycare anymore  Back from the hospital with the kids  Miss E cut her head while falling out of bed  3 stitches  but all better now ,31
21291,BBbri2013,I miss my friends and Brian   stupid summer   ,31
21330,BCBcupcakeluv,@EAJosh I miss you  ,31
21373,BCatt84,I miss my mom ,31
21442,BECCALEA2013,@margaret2015 I miss you too   Making pizza ,31
21455,BEKbeergirl,still sad the #Mavs season is over  someone cheer me up  I want some sushi today  @JennileeAutry lucky         I miss my princess ,31
21479,BEST_FRIEND929,Wow     i really miss him      ,31
21541,BGodwin22,@mzdollface miss you too    ,31
21560,BHamColombian,I miss working at the airport    ,31
21576,BIGBAM_HP,wondering why she mad i miss her so much and its only been a day ,31
21709,BL3SS,@Miss Mira never that  why would they   @miss mira @anahleen haha that s wassup  aww man no ddub hug   that s ur boo  u have 2 get 1 Had the worse sleep ever last night  @Mizz Alex ahha I have some bogies  p I ve been aight  my stomach been hurting a lot  @Miss Mira jk i rly haven t been feelin too good these past couple of days  sux @LegendaryWriter  lol  ive lost my creativity    i can t think of anything to write anymore lol thnx for the concern  @CiscoReyes hahha well its definitely a plus when a man can cook   @KEEPITMOVEMENT yea make that good music boys ,31
21745,BLONDIE4U2LUV,@Bella Diana @Miss Editha u girls work together and spend the whole time chatting    DITO ya really do love eachother ,31
21792,BML89,I miss my flute and it s very sad   Loading the van for the drive home   so sad   ,31
21820,BMcD,@les1ieryan hope Seattle treats you well    I miss you tons ,31
21844,BNS7792,Fair week starts tomorrow PUMPED  Babe made it to Kansas but i still dont know if hes coming home  Praying like no other  I MISS HIM,31
21885,BOOGIEANDERSON,is gonna miss tweet deck while I m at work ,31
21943,BPuglio,Miss my hubby so much  Been married since monday and haven t gotten to see him since cause I live in Oak Island and he s in Ft  Bragg    ,31
21982,BREEnigga,Going to miss you  Roo   ,31
22038,BRYANBREZE,@curtis i miss you so much  i miss our long talks we always had  @hollywoodhames hahaha ok teacher ,31
22109,BShieldsy,@Funnyguyls  i miss you too buddy ,31
22131,BSturggg,@toomuchriff I miss you too   ,31
22221,BWHunnel,@AMM1212 Ahhh 3 man   I will miss you   ,31
22241,BWilson_8,In Tulare  Im so sad bc i miss my merced  atwater  and turlock friends    At rehearsal   yay,31
22253,BYOBOB,I miss my sister   And I also miss a life without responsibilities  ,31
22285,B_Jeweled,@EYECANDY86 I m gonna miss u when u leave  I m really going to be lonely now  @DJ JOJ ur too busy for me now  but that s a good thing though  Keep doing big things ,31
22288,B_Langley,I miss my baby he ll be gone till tomorrow night ,31
22304,B_R_O1118,i really miss him  hope he comes home soon,31
22393,BabaCoca,@RedSkittlex3 i miss u more  i was in dubai,31
22456,Babii_Ashh73,It s N O N  P H I X I O N        Miss my Jedi Mind Tricks Music   ,31
22488,BabyBathory,Bowling was boring  The beer was good  I miss my hubs ,31
22550,BabyGirlTara,@JustGG11 Awoh well in the black shirt  hahahaha        I sent you a friend request there    xx hiya @hornedogg     whats  new           miss you ,31
22562,BabyGurl_xo,Babysitting is a little harder  the baby woke up at 3 AM started crying   no worries I ll make her feel better  I miss my brother  Watching the Hills  Omg lauren looks so beautiful on the red carpet  ,31
22691,BabyjaneJuliet,I miss my Mr C a lot ,31
22694,Babykins,I miss the underage feeling  i think i got mac and cheese up my nose ,31
22754,BackwooodBarbie,I am so hurt  and bored going to go get in the shower then think things over   Away from home for a couple days   sad and gonna miss everyone   love you all  got some cute things     But i want to see Trent  and Cupcake pretty bad   text me if you have my number ,31
22803,BadSamy,@MissKittywood Miss you darling ,31
22817,BadassChixx,Ok I confess I kinda miss Jayhsant ,31
22825,Badboy1071,Just dropped da kids off to go to camp    im gonna miss my lil micah ,31
23000,BajanEmpressTC,miss my babies ,31
23144,Bambamintheho,is really going to miss my cosuins    I hope to see you guys soon  l  L O V E you guys         ,31
23169,BambinoLino,I m gonna miss Jay Leno  I can t believe tomorrow is his last show ,31
23284,BangBang310,I miss my niggas in N O      Daron come back to LA ,31
23344,BaoanQ,@sandrja I miss you  ,31
23382,BarbSwensied,I keep forgetting how much I dislike Georgia   I miss LA already  Finally said something  Done  ,31
23472,BarbieMartini,i miss velvet  gotta go back next sunday  @MrVegasNYC it sureeee is  ppl just like giving it to me  @showtime757 bring it ,31
23880,BayleeRocker,Going to go work  I miss Chris  ,31
23939,Bball_matt_2703,@RealHughJackman when are you moving back to Australia   we all miss you   well mum does      matt,31
23954,Bbiie,oh I miss you already  LOVE YA   Sweet Kiss   ,31
23968,BbyPaty,I really miss Vielha  @ddlovato  woooooww your spanish is very good   ,31
24282,Beatles33,I just spent 3 amazing days in Disney World   I miss it already   ,31
24294,BeatrixH,every single tv show ends@ the same time  while they re all going  thr r so many i have to drop some  and now thr r none  i miss lost ,31
24299,BeatrizLovato,@davebleeds miss talkin to you  Dave ,31
24356,BeautifulSadist,@silverspoons Jon is the bestest and I really miss him ,31
24417,BeautyiFool,but my boyfriend had 2 got off the phone  i miss my boyfriend so much  i havnt seen him since friday    and its sunday and i wont c him till tuesday ,31
24436,BebaSanchez,@Ohmygoshi  I do too  I also miss being and undergrad and being a carefree girl  ohh life  ,31
24520,Becca829,is today is gonna stink  I already miss @amandiee spending time with mommy  just watched twilight   it was horrible   now I m watching Princess Diaries  I m sooo bored ,31
24673,Beccarene,Just took Colby Watson Brown to the airport   Love that boy   Gonna miss him ,31
24686,Becccccaa,little miss sunshine is on tv and dwayne just found out he s colourblind and it s really sad ,31
24732,BeckaMoor,Oooh  my head is not in a good place this morning  @shanajaca I ll go for that  but I don t have time to rest  I have too much work to do  @feltbeats That s right    kick me when I m down   @Cazling You can wear heels  I can t shred skin  I miss you  x Can t be bothered with today  I barely  tweet  anymore  makes me sad   amp  I miss Caz and Tick         x 2 My sister just made a surprise visit and told me she s staying here for a few days  Woo  So I m off to go and even out my  tan   @lilyginny27 Thanks  Me too    My exhibition in 3 hrs  it s going to be MAD packed what with family  friends  artists  tutors  The studio s only tiny  Ah well ,31
24798,Beckii_Thomas,can t believe she is going to miss out on watching the pies game on tv on sat cause she has to work       GO the MIGHTY MAGPIES  ,31
24803,Beckkaaa,Baby  I miss you so much  ,31
24810,Becks1234,@MissKatiePrice  Hellooo katie   i have watched your show all the way through   going to miss you and pete  hope everything works well x x,31
24897,BeckyMCFC,@Miss Bellatrix Thanks   I m totally bummed because it came out of nowhere  In a totally impersonal for letter e mail to boot  ,31
24900,BeckyMarkman,no @brianedward today  Sadness   Have fun in Cali  I ll miss youuuu It s weird to look at myself and see blonde hair again   not the red blonde in between color  ,31
25033,Bee1083,R I P To 6ABC s own Gary Papa  Philly and the rest of the Delaware Valley will miss you  ,31
25187,Beetlebug19,Going for pizza with the fam  Miss my dog ,31
25195,Beeyezzy,I miss my big head friend @realist08  o nooo I have stalkers another stalker this one sits outside of any location I may be  not good @ all wit my dude we sitting in traffic and rain this shit is not cool ,31
25232,BehBah,UGH  i MiSS MY FONEEEE  SOOOO DEPRESSED ,31
25263,BekThomas,@DarkAsKnight hey   Just droppin  off some love for ya   Haven t heard from  you in a while   Looks like I m gonna miss all the fun tdot   @BluePhoenix1  they ll miss you ,31
25291,BekahsLullaby,Wow  So close yet SO far away  @BrittanyCurran Haha I didnt know you had a twitterr  I miss Photo with you ,31
25415,Belisus,I want to live in peace    I miss you   ,31
25433,Bella2492,such beautiful nite   i miss my cupcake ,31
25469,BellaDee143,Happy Father s Day too all you great dads  I miss my dad  ,31
25512,BellaMuerte6,i miss lancey me and him were to run away in to a the woods  i fell like shit i miss my Knight   Netslum Gaychat   i miss lancey me and him were to run away in to  the woods  i fell like shit i miss my Knight   Netslum Gaychat   talking to the ppl i love b4 time runs out    Netslum Gaychat   reading hot fan fic listening to Muse and talking to my bff and a great ass fucken girl  my night is fucken great    Netslum Gaychat  ,31
25558,Bella_Marie_C,@alicehcullen  goodnight enjoy it see you later  i miss you @Vampire Vicky that  s good i  m fine  do you like my new picture  ,31
25782,BenJCunliffe,Thunder storms   Whats that all about  I miss England ,31
25813,BenOfAllTrades,Can t believe that The Real Deal just played on his radio   To think my band almost opened for them  man did we miss our big shot ,31
25960,BenjaminJL,getting sick      ugh going to work I am leaving the country in  4 hours  miss u all  im rly gonna miss SWF  good thing im seeing them sat night  ,31
25961,BenjaminJMoran,@maddiehartloff   miss you maddie,31
26355,Betaknight,My dog Died  FUCKING ZUCKY  i ll miss ya Cody     finest malemute ever Time to Bump whilst High ,31
26404,BethDanielle,boys r dumb  my lauren needs 2 get her new phone so I can seek her advice  miss her  but dont miss being out w  the crazies in hollywierd  iiii just had a huge bug crawling on my chest  that ll teach me to not open my window a crack on the drive home from vegas to litter  @SavannahLovely I LOVE YOU DANNA     you left ur starbucks in the car  its like half full too  soooo bitter at @jonasbrothers cause I can t upload my penn and shia pics  @jacky ds they were both in ojai today   @TheLadyKristin @juanton711 they have the people at the albertsons in burbank but I had no money when I was there tonight  @juanton711 yes stupid computer is down  I need to wait for a disc from my roomate to try to reboot  @girlcanrock oh no       watching SWAC makes me miss demi with brown hair  bangs and white skin   wow  I beat @PerezHilton  @HarveyLevinTMZ and @hollywoodtv with the Farrah Fawcett news  those celeb news sites gotta step it up   3am hang out sesh with me and mr deangelo  great times  he s the best  ,31
26415,BethGoldenx,Canada i miss you still ,31
26420,BethHeinbeck,Excited to watch the VMA s and see Kings of Leon perform      I miss them ,31
26516,BethanyBump,@Adri Gon miss you roomie  Woke up too early this morning  I ll pay for this later Watching old TV shows and making mix CDs since there s no ipod plug in in my car ,31
26526,BethanyLandon90,Watching the hills finally I love Lauren Conrad   Ill admit I have tears I can t believe she s leaving the hills will suck without her    nothing it did nothing    gt    mad  and sad my Esme aka Brittany is moving to Texas  i already miss her to death  ,31
26535,BethanyMunson,@melissamunson 1  I miss you tooooo  Only 5 more weeks  2  I know they don t  but it still made me miss it ,31
26578,Bethelica,@fr4ncium I M ON A BOAT MOTHAFUCKAAAAAAA awww i miss you ,31
26591,BethhhJ,why won t you shut up for once           i miss you ,31
26678,BetsyPhan,@WhitneyEileen Pretty sure I miss you TONS already   is updating her Twitter for Whitty Whit ,31
26680,BetsyYoung,@agochoa I miss you ,31
26692,BetteDi_sCanvas,Crosstown Classic cancelled 4 2nite  Fack  6 5 cubs  @missnadina COME TO CHICAGO    I miss u sooo much  Breakfast @Old Warsaw with the kids    Makes mouths happy ,31
26720,BettyBloodshed,Hasta Luego New York    lt 333 @colleensez I ll miss you  boo   Busch gardens tomorrow  I already hurt my stupid knee  lol  Miss you  NYers  ,31
26731,BettyKaya,@duruonver      C mone girl     I can t wait 11 days    It s too long        I miss you more         I love you too   ,31
26942,Bhairavi_P,I miss you so   much   I m thinking of you all the time  Hell   No   Ha ha  Evil Laugh   @,31
27197,BigBossT65,where all the follows at  I miss SD already  sigh  ,31
27259,BigE03,Needs to find a job but doesn t quite know where to look   is depressed   I guess i just miss home  Can t wait to have an Arby s Beef and Chedar with curly fries   It s been sooo long   @PeterJDiLorenzo i loved that video as well  ,31
27367,BigSarge_16,@shanlovesannick hahaha no shittt    last lesson  im gonna miss youu @yazmadjian hiii shelbyyy ,31
27376,BigStarErin,The one thing that sucks about Astros at Ranger s Ballpark  No @StArnold for sale  I miss Minute Maid,31
27386,BigVic99,Hey Jenny  I m free  On my way to work though  so I ll miss the postgame show ,31
27437,Bigdaddy72,Off to church then lunch then its time to miss my wife and kids  ,31
27450,BiggaPimp,2 hours out of Van  I will miss you Desert Eagle ,31
27471,BiggzNMe,@rosalie belle miss you too it s been too long now ,31
27494,BiiBeautifull,Rescued a baby jack rabbit  nursed it back to health  now taking it to a conservation site  I m gonna miss you Shakespeare,31
27591,BillRuffner,i miss home and living in columbus ,31
27776,BinkyBunny,@aplusk  I miss webvan  We used to use them all the time and then they went out of business around the SF Bay area  ,31
27796,Binx13,@pravvyprav i miss you already  ,31
27923,BitchMoveBoone,omg my seniors are gonna graduate today  im gonna miss them so so sooo much its so weird with out the seniors     ,31
28061,Bjorno,I love hookah  oh how I miss real tobacco   ,31
28091,Bklynst8ofmind,so does this mean nomore lebron and kobe commercials  ima miss those they were funny  couldnt sleep 2 much on my mind ,31
28115,Black1995Flower,2Day Waz Graduation It was Fun But Imma Miss Ma Friends  ,31
28151,BlackEricaKane,is making preparations for the week to come   heading back to work after a long hiatus   will miss being a stay at home Mom ,31
28253,Blackhawk63,Got up at 4 30 this morning to catch a flight to Chicago  Delays caused me to miss my connecting flight  ,31
28358,Blairisawesome,@lilmay1989 and i will miss u ,31
28463,BlaqueStar,@KiyastarW ya best friend is retarded  lol  i laughed so hard at that  quot dream   comment  i miss you guys ,31
28667,Blitz_Love_Rose,I miss space mountain    ,31
28674,Blixinator,I miss colbert s hair  ,31
28790,Blondie190,@KatieBanana i miss you too  ,31
28844,BloodRavyne,I miss my computer ,31
28931,Bludston,@mzvictoria  big grin  Well I certainly wouldn t say no  I miss you folks ,31
28933,Blue831,Listening to my poetry track last night and it makes me miss writing with @amethystglaze   Its a little after 5am and poppa bear just pulled off  He s on his way to dc with more checks than ever  ,31
29011,BlueMagic_7x3x0,@whispher I m a miss it   too far ,31
29076,Blueberryy,I miss Chicago   Get me out of PA ,31
29144,BlurChic,i miss my puppy  ,31
29152,Blurtz,@itsashlz  mmmmmwwwwaaaaaarrrrr i MISS YOU       Fantassising about being back in melbourne  i miss you ,31
29180,BlytheRayne,Clint has to go to work to  i miss him already,31
29212,BnetEntertain,is going to miss the Real Housewives of New Jersey  ,31
29392,BobbyHendrix,@SeptMourningM Texas is far from phx  LOL  what part  I need a way to get to the kid liberty show tonight  any takers  I miss her so much  I just wish it was next Sunday already so I could see her   @ambeeee lies  haha jk im getting sick  someone come over and take care of me  i miss my friends Dylan and Alex  my summer has been ruined  i cant stop crying good thing @kieferireland is here to comfort me haha @Brina07 yes but i miss california  lol tell your family thanks for everything   we miss you all,31
29421,BobcatJav,Drove by the little league fields today  I really miss coaching baseball in Kyrgyzstan ,31
29503,Boedullus,I am going to miss my weedas so much  Even the ones I don t like  ,31
29549,Bohunian,Return To The Forbidden Planet was amazing  i really do miss performing it  especially because i loved the outfits haha  ,31
29565,Bojanikus,Otisle mace    Miss all of them forever     Otisle mace    I miss all of them    ,31
29826,Boofcapricorn,My lil ones are gone for the summer  I shall miss them  Now    time to focus  Moving on   ,31
29849,BookFaace,@roseCHARLOTTE oh my gosh    Tomorrow AS WELL                God you re lucky  I might have to put it off for yet ANOTHER week   Owwww  My feet hurt from walking across the Humber Bridge   I ve just realised how much cool stuff there was whilst I was growing up  I miss the shows and the toys  I miss it all  @TickleMeJoey can you please give a shoutout as my hand is in pain after it was trapped in a window again today  x I m actually in love with Fly With Me  i can t stop listening to it  Can t wait for LVATT to come out   Great stuff  my mother is slightly sozzled    On the plus side though  i ve reached my 300th Tweet  I deserve some kind of medal   @petewentz definately   That s like my favourite song off the album  @ticklemejoey are those lyrics  If they are what song are they out of and they re pretty cool ,31
29893,Bookworm_13,i love my brother bein down but      I MISS MY BEEEEEDDD    ,31
29937,Booninay,@xtelicious Aren t you coming on saturday   Back to being a poker correspondent  Miss it  ,31
30072,BorrachaBean,@elfia i know  miss you  me  stoy muy triste ,31
30240,Bow2daQueen,Freakin tired    And it s only 11  i feel like a nerd today     haha i miss everyone at home     I miss my computer  ,31
30250,Bower2002,Co worker s last day  we are going to miss her,31
30265,BowsANDHearts,I really miss you  Ashley  I can t believe I won t see you until Friday ,31
30291,Boxue_T,@Seowhow @Lia Chan Hi Pastors  we gonna miss you  Enjoy the trip and rest well  ,31
30323,BoynamedMatt,@valsartdiary haha  i saw that  i miss the ones at my school  computer problems  @valsartdiary you should start reviewing some of these movies  or at least tell me what u think ,31
30444,Brad_is_dead,On my way to caax  Man I m going to miss you mr  Jeep  You have brought me much joy the last few years     ,31
30534,Brainlock72,@kryptonsite A lot of people called it when they saw the schedule  I ll miss #Reaper   and #Sock  ,31
30546,Bralex29,I miss my 8703 ,31
30627,BrandiSouth,@hollybooch i already miss you  ,31
30632,Brandi_26,had an AMAZING time yesterday   i miss him tho ,31
30733,Brandon_Bray,@stevenlwelch hey man   i miss you   say hi to danina and van for me bra  end transmission,31
30859,Bray_Dawg,@MANDY my melody  I miss you too  and ok I guess  girl problems lol  How about you  ,31
30881,Brbarrios,Not happy with my grandma right now     Barrios Going 2 miss Romo so much while i am gone    Barrios,31
30913,BreNicole2,The Hills finale  I miss Lauren already  MTV Movie awards then Dateline just for my daily dose of Taylor ,31
30946,Break0utx,i rlly miss ya jessy     lt 3 ,31
30974,Breakout_Smiley,Melody miss you soo much ,31
30991,BreannaBoss,@LovinJJ really    Still light  That s amazing  Miss you ,31
31000,BreannaUngerr,got our asses handed to us   lost like 12 0  @katisneat I miss you already ,31
31108,Breezaa,I miss Angiii  I miss talking too her  I love you Angiii  @StephSharratt I have to work too  BUT OMG  did you hear on @Jonasbrothers live chat    THEY RE COMING IN DECEMBER ,31
31120,Breezy0408,@Britt625 I miss u   ecspecially last night ,31
31131,BreezyKegger,is getting her hair dieddddddd  i miss my baby ,31
31141,Breezyroo,two more days until Sims 3    yay  I miss Triple H and Stephanie  just went shopping but i m still bummed about no wrestling for me    no Triple H ,31
31203,Brenda_Madden,Upset that Hawksley isn t coming to St  John s this fall       We ll miss you ,31
31216,BrendanPatrick,@ the lunch stop  Only 2 customers so far today  Sun is breaking thru the fog  turning into a GORGEOUS day  #alc8 Holy moly  The breakfast line is a mile long     Your favorite sweep team  us   hits the route at 7 15  wish us a boring day  #alc8 Just picked up a customer with a bent wheel   On PCH  kinda scary riding in so much traffic  But everyone s excited 2 be finished   #alc8 How weird to wake up with Gertie next to me  I sort miss my cozy sleeping bag  but it ll be there next year  Miss u guys already  #alc8,31
31228,BrendenStevens,@ValerieStevens Why is your picture green     Also I need to come down soon I miss my mom ,31
31252,BrennaMiazga,Also  my rental car reminds me how much I miss driving a car  ,31
31324,BrettAMarlow,I kinda miss my hair that I decided to cut off  ,31
31390,BriAshley88,@TraceeEllisRoss found out Maya was cheating   that ending part was soo full of emotions   i miss the show  Wat is in store for u   ,31
