,username,tweet,cluster
22758,BaconSamurai,http   tinyurl com oayevs Last Guardian trailer  The monster is so big and cute  Knowing the Ico team  it ll die ,5
22759,Baconfeed,@MrsFox Yeah    doesn t taste like #bacon at all   http   tinyurl com c2wwgp 4am wake up call   probably not going to make it to @bad decisions for #bacon  amp  beer happy hour  everyone else   http   tinyurl com mm3gzr @linuxchic inlude talk of #bacon  http   tinyurl com cq54m8 @skibumbrian777 no see  hawaiin pizza is just wrong   it has warm pineapple  and ham  try harder next time  #B   http   tinyurl com m5sso9 Woke up feeling like I ate half a pig last night  Oh   right   yum #bacon  http   tinyurl com knv82o Let me tell ya the #bacon @RSHotel is delish  Makes me happy to be a bad Jew   http   tinyurl com px9gfb,5
22771,BadAzzBrad,Be back lata  Got work 2 do  http   myloc me 4suz Jus finished luch with an old friend collegue  Was great to see him  amp  catch up  Now  back to work  http   myloc me 5dXo,5
22797,BadLuckKP,Photo  resunsaysdope  They cancelled the Miami leg  that sucks   i wonder if i can find out exactly what    http   tumblr com xtl1x1vix,5
22809,BadTeachers,@shannatrenholm   Post a complaint about the teacher at www TeacherComplaints com  Tell your friends and other students to do the same  @NBCConnecticut   Post a complaint about the teacher at www TeacherComplaints com  Tell your friends and other students to do the same  @7News   Post a complaint about the teacher at www TeacherComplaints com  Tell your friends and other students to do the same  @M3GH  Post a complaint about the teacher at www TeacherComplaints com  Tell your friends and other students to do the same ,5
22870,Baenhoof,@Cadistra No freakin kidding  I think the repair guy at Venomspite is a little pissed at us for not visiting much  We used to be so close  Poor guy  Stormwind is painful  @WoWInsider One  Lots at 70 75 though  Heh  gt   gt  http   tinyurl com cy3ryl Plants Vs  Zombies  CUTE AS HELL towerdefense type game from Popcap  check it out ,5
22892,Baghy,Just listed a new elegant leather journal http   bit ly NXgFm  I hope you like it guys via http   twib es 51D,5
22913,Bahijah,is at Rasta and the wifi here sucks   Having problem with the TwitterDeck   This is the part where I really dont feel lucky being a girl  Period Pain   Diet starts today  It is 7am and already craving for a good old cendol   Another one popped up a human being  Congrats Nana and Wan   Baby Iris is a cutie  A game of poker and a locoroco to kill the time before the movie  We are boring but this is what we do best  http   twitpic com 6qk1l,5
22930,BaileeAlyssa,@kellierasberry http   twitpic com 4eqhl   Aww She is too cute  And wow she must be pretty fastt   ,5
22989,BainMercerGirl,@wahliaodotcom so what exactly u do  i cant access ur web link  @wahliaodotcom no it is not up yet  @jovenatheart Great   @nomorelayoffs thanx for the info  @nikipaniki wow thats really great  haha enjoy ur holidays  @tnsSG look forward to ur tweets  great job there  Check out my blog at  http   tinyurl com qe4nn6 @market maverick look forward to ur tweets  great job there  Check out my blog at http   tinyurl com qe4nn6 @TheAffiliateGuy Look forward to ur tweets   great job there  Check out my blog at http   tinyurl com qe4nn6 @AffiliateStar I look forward to ur tweets   great job there  Check out my blog at http   tinyurl com qe4nn6 @wahliaodotcom seriously love ur name  It is so SG     And yup i m doing online marketing in Bain  amp  Mercer  www bainmercer com   @inrsoul btw when is ur site going to be up  im excited to see ur creations  @sg skaters hey  thanx for the follow  i look forward to ur tweets  @agbmedia hey  thanx for the follow  i look forward to ur tweets  http   tinyurl com dlolvh Website planning   Read it  @Sarah Chong That s great   Good morning   Singapore time  11 14am @AsiaBrands thanx alot   tyty @RamonAtQUEST that s healthy  greeting is good ,5
22993,Bairon_, Great     http   blip fm  7df6m,5
23011,BakeHouse,http   twitpic com 6v42q   Busy day at Genesis Bicycles in Easton  PA  Got in a great ride  now hubby has some shop work to do ,5
23013,BakeMeUpLA,@szsz  Sorry to hear that  We ll have to bake some gluten free things   my  Spaz deck isn t working  have to get on my other account somehow  Wishing @jennifaojennyjen all the best  Sending her lots of XOXOXO s   Hope everything works out  @peacefullvegan I LOVE PD  So fucking good  I wanted to try something new   I give it 2 5 5 stars  It s meh   @veganhope In that case count me in  Woo  Desserts are my weakness  Thank you @vegankitten for your donation to our TipJoy   http   tipjoy com joy 237330  Thanks @KissMyBundt @thomasjayr for the FF  @josierodgers Take pictures  I wanna see them  Thank you so much @sophie0 for your donation to our TipJoy   http   tipjoy com joy 237330 ,5
23108,BamBamCreative,Kraftbomb tomorrow   Come tell me a funny joke and I ll give you something pretty  http   www bambamcreative blogspot com @rwscissors sort it out sunshine   I m the first to heart your shop  yay  @sarahkat personally not a coffee drinker  tea is my drug of choice ,5
23137,Bamanu,is sooo damn confused   http   plurk com p wh1m6,5
23184,BamfAC,@mmitchelldaviss http   twitpic com 6emun   aww  what about kyle   About to record a song called The Climb  ,5
23199,BanBr0kenHearts,http   twitpic com 6upsz   My boyfriend won all these tickets to buy me a peegie bank  hehehheeeeep,5
23212,BananaDance,says my jaw hurts  http   plurk com p xbs88 feels so lonely todaaay  HAPPY FATHERS DAY though  p http   plurk com p 12lkwh,5
23356,BarFryGuy,What are your favorite fries   I ll find a bar with the best of the best fries and you can enjoy them for FREE  http   barfryguy com @herbar Good luck with the grand opening the next time I m in Vegas  I ll come by and do a review for my site  www barfryguy com,5
23371,BarbAtSea,@sherryfm  Favorite had the crush on you    but he isn t on Facebook    @zappos fly  I didn t find the muddy paws the worst  It was the muddy belly  Their paws kick up mud and his black belly would be covered   This is the result of his cookbook review and trip to Hannaford s http   twitpic com 4wz3v   I LOVE E W  and E W  LOVES me   ,5
23390,Barbara858,Anyone awake out there besides me   http   myloc me 47S9 @MissKrystaJean that reminds me of yesterday   http   myloc me 1MEW,5
23429,Barbarellaf,JESUS  just hearing about this murder of abortion Dr  http   bit ly GlOkb   ,5
23445,BarbiSimone,How to Get Your Ex Back  worked for me  http   bit ly ec8qJ,5
23450,Barbie1107,@IAMCOMPASS lol NiiCE     She said Hiii  http   twitpic com 6t5ti   Who agrees with me 3p has the best chap pizza ,5
23492,Barbreezy,Good morning  I m loving this gloomy Cali weather  Having breakfast with Ricky in Manhattan Beach  Have a great weekend  @Jose Latin http   twitpic com 7bjh2   Look at those eye lashes   She s a doll   I just wanna bite those cheeks   Awww   she s perfect ,5
23496,BarbwireAustin,ok the show is starting soon   you can sign up anytime http   www tinyurl com barbwireaustin  its full nudity   dm me when done   ,5
23522,Barefootmelody,Mission Statement or something like that    psykoid com http   bit ly 11ERzA,5
23529,BargainBevs,@theSTID Really Cheap Gordons Vodka at University Stop  http   twitpic com 6vtqj,5
23543,Barista_Alex,Finally  I just created my WordPress Blog  There s already a blog up on the Seattle Coffee Community      http   tinyurl com c5uufd,5
23546,BarkBiteBlog,My Eminem post is the top story on http   www mog com woo hoo  ,5
23554,Barkhamn,Thank you for the hint @unfinishedperson    http   blip fm  5e7qe,5
23555,BarkingCarrot,Ha  Me and my sign  It s 2009  Why do we still have to fight 4  made it on the news tonight  http   www kmbc com news 19570919 detail html,5
23590,BarradeNavidad,#HIN1 #SanLuis streets empty  http   www oem com mx elsoldesanluis notas n1144741 htm  So when this nightmr is over Visit #San Luis Potosi,5
23607,BarryCorrigan,Hatton career over Manny was way too fast for him  Knocked him out in just over two minutes  @chriscolhoun Spent a day there last summer  Lovely city  I would recommend the Magic Fountains at night  http   tinyurl com dkv8on,5
23634,Bartdejong86,http   twitpic com 4j3yq   arrived at Los Angeles   warm welcome  @Zuidam in the boardroom       @johanbruyneel i count 12 Tour de France wins     tonight @ersamusic s b day bash  it will involve a lot of twitterati  too many to mention here  http   twitpic com 6tiou   we did some analog tweets last night  @cellec omg the whole flashover crew is infected with the virus    we def need some tamiflu  @cellec don t they got normal lunchtimes @flashoverrec     ,5
23731,BastaYaGuate,and excuses by the writing but I do not speak English I am of Guatemala        and excuses by the wr   http   tr im oRGX Study Abroad in China  amp  Volunteering in Guatemala  Almost Over  http   bit ly QI5qI  Study Abroad in China  amp am   http   tr im pd8J,5
23735,Basthees,Concussion is getting better  but unfortunetly I still can t take my German exam tomorrow  Uhh  Finally a new video up on YouTube    Please watch  comment  rate and subscribe  http   bit ly 5ohPx I feel A LOT better today  So I m doing normal things again  like being on the computer  I just have to remember to take breaks  NEW VIDEO  GO WACHT IT  it would make me happy   link  http   bit ly 11D4Ap,5
23789,Batikl,Checking out http michiganbeat com  good music ,5
23834,Baunii,another amazing video from FFXIII   wish i was part of the Square enix s design team  http   tinyurl com q22qb9,5
23859,BayanHippo,Did you see my new red and white striped SAILOR TOTE   http   bit ly XkjDf,5
23922,BazookaComedy,@craftychica http   twitpic com 6uadm   well  don t you make perfect circles   o haha i love this  it s cool ,5
24006,BeCosmic,How can I help  What should could I have done  How do I face his family   what on earth can I say  Where is the hope   the end of loss   That s it no beer left    http   twitpic com 6uh13,5
24059,Bea2912,http   twitpic com 6setr   Cristy Love You so Much    4 Days go to Madrid             In the Party of San Agustin ,5
24108,BeadNestDesigns,It s not easy being green  but it IS easy being these    http   bit ly xP9Ve,5
24193,BearHub,aronski      Michael McKean   FriendFeed  from aronski    It s gone all Scottish  tartan fail  re  http   tinyurl com knf8bf steverubel    Telecommunication   Hardware Systems   Networking   Consumer Electronics        Elgan says the    http   tinyurl com mkhduk,5
24194,BearMoney,Promotional Message    Ethical Twitter Marketing Practices http   budurl com twittaff,5
24196,BearNoiz,@verwon tis a funny sketch  tho my fave was the all drug olympics  had them both on my youtube at one point but nbc claimed back rights  @Wossy did they make her eat some toast b4 she could come home  i hated having to do that  ouchy ouch ouch  @Lokizilla if i think of nything else ill ping ya but atm the only other thing in my head are stuff to recover deleted files  @lupestripe if i used LJ id join but i dont so sorry  but im sure others will @SlyCatUK though theyre not pc zone n stuff  all look like pcw n pc format so doubt we will have any joy  @hetzakoatl yeah astra is ok but ive gone back to the old trillian as its less bloated  tho i miss the gmail notifications now  @Twistedlilkitty neither did mine  http   twitpic com 73aiz #linproducts @gothicat btw what happened  I tried calling you afterwards as I couldnt find the pub from your vague description but just got ansafone  @dscriven shiz marn thats a nightmare roll out  yeah will ave 2 pop by  busy all day 2morow n its soltace sun morn so will do tings then  loves the fact he just reclaimed a 1st class stamp that hadnt been franked  54p mine allllll mine  S http   plurk com p n0e3f @turbinedivinity indeed  another world  flashback  sensible soccer  supercars  c amp c red alert  shadow warrior  any psygnosis or dma title  @computermuseum http   twitpic com 4wptj one of my prized mags book annuals dunno if any others were published prolly should google it  @computermuseum shame I dont still have my 286 compaq portable  which was really anything but portable LMAO  last tweet 4 now  toodle pip  Way to go @stephenfry thats a lotta moohlah    O o    tho IMO your priceless and should be made a national treasure if not declared a god  Well its a goody @Lokizilla and thanks to @smashpop for pinging you with it  Hi Fu  @plaguecat hope ya get this  @lazmad that one has a body though  I was expecting something much moar deformed LOL that pic is perfectly conceiveable as a puffin  @mashiankrekku oh well  thefox one is cool   amp  even if ya cant pick ya icon they did pick the username LOL @mashiankrekku well he certainly has a great icon  Where theres fur theres drama LMAO Its like the law or something ROFL http   tinyurl com meeuhb followed by some  Jungle  Book  http   plurk com p xkyfa @hetzakoatl yeah plurk is like twitter but each convo or post is contained within its own thread etc  can use css to modify page n tings Ahh Death Race 2000 such an awesomely bad film @charltonbrooker whod have thought stallone could get moar wooden as his career progressed  @MarijuanaTunes Just discussing how Jar of Flies  amp  Dirt were class albums  think you should hit Helmet   Unsung as that rocks too  http   tinyurl com kwmynq Helmet   Unsung to start your day  http   plurk com p yshbc Yaaaaay the buggles are on  @sin gin yup wouldnt say them in nasty way  moarso  cheeky  tongue in cheek repost  but yeah defo dont hurt feelings  tho humor eases that @Neurario @Selth Morning btw  Good Luck @korrok Hope you pass with flying colours  @garyoreilly class  need to get to yours n doodle the rest of that tree so can grab it then  hollar at me on da mob when your free All I can say is virtual size higher but working set  amp  peak R smaller @magoon http   twitpic com 7gigl Im just not fully switching yet  @mixmasterfestus tho I mix it till abt 6mins into the vid  there was a killer bootleg remix on youtube but that got pulled  but it was mad @TheDarkGlove flight n bumped it  moved him up to the moss thing Im cultivating  so hed be safe  when I find the older pics ill ping em up,5
24199,BearPawsMusic,Bahhhh     no mushrooms  Yep yep  Come this saturday   http   bit ly n4sMM,5
24219,BearicaGrills,ugh its so dark and glooomy out  http   twitpic com 6p3im   best birthday present ever ,5
24225,BearsBeetsLiz,Just got to talk to my baby Biata     In  Africa     http   yfrog com 0k289pj She didn t know how to use a phone veer well though    ,5
24244,BeastieWeenie,Another press plug from this fun blog http   bit ly xmhgm  I like her description of my work ,5
24262,BeataAntonio,AT amp T keeps screwing up  Ah  Verizon needs to pump some gears and get their deals rolling  I miss VZW  lol http   tinyurl com knvtgr Really excited Kobe got a ring without Shaq      haha http   tinyurl com mbquaf,5
24297,BeatrizCV,@JBtamaraJb http   twitpic com 6uvls   I support Kevin    He is so special  I love him   Only 6 days to meet him at concert in Madrid ,5
24306,Beatz4YaFeetz,Reached my PROPX limt  @LuckySong @ZOEBOE @KatelynD @Rella Shout tweetmeme com aka da hottest links  i see u        http   blip fm  7jeu1,5
24309,BeauDancer,@theellenshow http   twitpic com 7ogn7   Omg i live in Chicago  i wish i was there  ,5
24331,Beautee_Deyor,@XavionMGaBBana I was sick  http   myloc me 3VAI @XavionMGaBBana oh yeah I m jealous   I wish I was off  http   myloc me 4hR2,5
24358,BeautifulSoul_,@JesseMcCartney Follow me please    amp  please answer this question  Will you one day come to Macedonia  I m fan since Dream Street     The capital of Macedonia is Skopje     just so you know lol  When you re 15 look before you fall  @backstreetsmac http   twitpic com 6gy9x   lucky  I loveeeeeeee him  hope you like that  It s from my book ,5
24375,Beautifullgirl,#musicmonday http   www myspace com sidec SO good  check em out  ,5
24433,Beazlebubba,no phone tweets until the twitterific update goes thru    http   twitpic com 7jo06 #art  an older piece I made for a friend,5
24465,Bec1512,Have netball training early again tomorrow morning   starts at 6 30am    I don t do mornings  Lines Vines and Trying Times world wide release today   Except for Australia    out Friday   very disappointed  @Jonasbrothers  We love you too   @nickjonas http   twitpic com 7dhbp   I miss Paris    I was there last year for a holiday    am very jealous   ,5
24493,BecReedman,@jessiemayumi Shame about your job  have you thought about working for yourself   there s big money to be paid http   bit ly 1864ml @BrittneyCash Shame about your job  have you thought about working for yourself   there s big money to be paid http   bit ly 1864ml @jerusha Shame about your job  have you thought about working for yourself   there s big money to be paid http   bit ly 1864ml @westhgate Shame about your job  have you thought about working for yourself   there s big money to be paid http   bit ly 1864ml @westhgate Shame about your job  have you thought about working for yourself   there s big money to be paid http   bit ly 1864ml @JoyfulMonster Shame about your job  have you thought about working for yourself   there s big money to be paid http   bit ly 1864ml @ctujb24 Shame about your job  have you thought about working for yourself   there s big money to be paid http   bit ly 1864ml @fortheravers Shame about your job  have you thought about working for yourself   there s big money to be paid http   bit ly 1864ml @Evelight Shame about your job  have you thought about working for yourself   there s big money to be paid http   bit ly 1864ml @Evelight Shame about your job  have you thought about working for yourself   there s big money to be paid http   bit ly 1864ml @twitbuddy test Shame about your job  have you thought about working for yourself   there s big money to be paid http   bit ly 1864ml @twitbuddy test Shame about your job  have you thought about working for yourself   there s big money to be paid http   bit ly 1864ml @rudiesweetpea Shame about your job  have you thought about working for yourself   there s big money to be paid http   bit ly 1864ml @cjdkc Shame about your job  have you thought about working for yourself   there s big money to be paid http   bit ly 1864ml @xiangster  Hard to find a new job in this climate   Check out what I started doing when I left my job http   bit ly 16lR51 @TownsleyBoy Shame about your job  have you thought about working for yourself   there s big money to be paid http   bit ly 1864ml @ti mayco That sucks   Have you thought about a franchise type business   I do this  http   bit ly 1864ml @diann170  Hard to find a new job in this climate   Check out what I started doing when I left my job http   bit ly 16lR51 @toddjustice your link didn t work  @MatthewFroese That sucks   Have you thought about a franchise type business   I do this  http   bit ly 1864ml @RobinRene That sucks   Have you thought about a franchise type business   I do this  http   bit ly 1864ml @toddjustice it came through just before I messaged you   it interested me enough to actually click on it  sorry I cant be of more help   @sashamilky that sucks  hope you find something that works for you @job4meandu  Hard to find a new job in this climate   Check out what I started doing when I left my job http   bit ly 16lR51 @TownsleyBoy Twitter is doing something strange   wont let me still  @shiraz ali That sucks   Have you thought about a franchise type business   I do this  http   bit ly 1864ml @loganlamson  Hard to find a new job in this climate   Check out what I started doing when I left my job http   bit ly 16lR51 @SpacedRant Shame about your job  have you thought about working for yourself   there s big money to be paid http   bit ly 1864ml @battlebays That sucks   Have you thought about a franchise type business   I do this  http   bit ly 1864ml @TATTOOED CHICK That sucks   Have you thought about a franchise type business   I do this  http   bit ly 1864ml @ saladkiller  Hard to find a new job in this climate   Check out what I started doing when I left my job http   bit ly 16lR51 @SAVINGS MALL Shame about your job  have you thought about working for yourself   there s big money to be paid http   bit ly 1864ml @jessicawaters shame  the climate I guess @CHILfreebies That sucks   Have you thought about a franchise type business   I do this  http   bit ly 1864ml @Icklesal  Hard to find a new job in this climate   Check out what I started doing when I left my job http   bit ly 16lR51 @LadyRubaiyat That sucks   Have you thought about a franchise type business   I do this  http   bit ly 1864ml @simonkeenan007  Hard to find a new job in this climate   Check out what I started doing when I left my job http   bit ly 16lR51 @cavynwalker Shame about your job  have you thought about working for yourself   there s big money to be paid http   bit ly 1864ml @buffysquirrel That sucks   Have you thought about a franchise type business   I do this  http   bit ly 1864ml @msblessness Shame about your job  have you thought about working for yourself   there s big money to be paid http   bit ly 1864ml @msblessness That sucks   Have you thought about a franchise type business   I do this  http   bit ly 1864ml @Bluefairy0173  Hard to find a new job in this climate   Check out what I started doing when I left my job http   bit ly 16lR51 @brian nathaniel Shame about your job  have you thought about working for yourself   there s big money to be paid http   bit ly 1864ml @brian nathaniel That sucks   Have you thought about a franchise type business   I do this  http   bit ly 1864ml @womenforchange  Hard to find a new job in this climate   Check out what I started doing when I left my job http   bit ly 16lR51 @kay don Shame about your job  have you thought about working for yourself   there s big money to be paid http   bit ly 1864ml @howdous Shame about your job  have you thought about working for yourself   there s big money to be paid http   bit ly 1864ml @monnie That sucks   Have you thought about a franchise type business   I do this  http   bit ly 1864ml @braveheart133  Hard to find a new job in this climate   Check out what I started doing when I left my job http   bit ly 16lR51 @dmjeanne That sucks   Have you thought about a franchise type business   I do this  http   bit ly 1864ml @mhaydon Shame about your job  have you thought about working for yourself   there s big money to be paid http   bit ly 1864ml @andrewd9ers That sucks   Have you thought about a franchise type business   I do this  http   bit ly 1864ml @Darkbird18 Shame about your job  have you thought about working for yourself   there s big money to be paid http   bit ly 1864ml @dingledebt That sucks   Have you thought about a franchise type business   I do this  http   bit ly 1864ml @joachimmeerkerk  Hard to find a new job in this climate   Check out what I started doing when I left my job http   bit ly 16lR51 @fubumdhc Shame about your job  have you thought about working for yourself   there s big money to be paid http   bit ly 1864ml @GeekPornGirl That sucks   Have you thought about a franchise type business   I do this  http   bit ly 1864ml @deardaveed  Hard to find a new job in this climate   Check out what I started doing when I left my job http   bit ly 16lR51 @darrens13 That sucks   Have you thought about a franchise type business   I do this  http   bit ly 1864ml @timorousme Shame about your job  have you thought about working for yourself   there s big money to be paid http   bit ly 1864ml @abc That sucks   Have you thought about a franchise type business   I do this  http   bit ly 1864ml @seturin2kil  Hard to find a new job in this climate   Check out what I started doing when I left my job http   bit ly 16lR51 @DellHenry Shame about your job  have you thought about working for yourself   there s big money to be paid http   bit ly 1864ml @swfgeek   yeah I know   I love my work too   just hate it when I have to be away from my family  take care @JustPlayPoker sorry   didn t mean to offend  Just trying to spread the word on a cool opportunity  @williger lol   ok cool   All the best with what you re doing  @terryupton lol   see indeed   Hawaii here we come  @SarahPadron yeah I know   I decided I couldn t work for anyone else anymore   frustrated me too much  http   bit ly 16lR51 @meagxo yeah I know   I decided I couldn t work for anyone else anymore   frustrated me too much  http   bit ly 16lR51 @zedomaxnet I think Australia needs a national donut day  @marketingsushi sure   what do you want feedback on ,5
24585,BeccaLovesMcFLY,@gfalcone601 i join you in the sickness train   it sucks  @t4witter http   twitpic com 4gx7l   aha awesome  bring on june 20th ,5
24620,Becca_Alice,@jonasbrothers http   twitpic com 624qo   Awk bless Elvis is sssooo cute  look at him smiling   hehe  xxxx,5
24630,Becca_Jade,All this Jonas Concert videos    There making me soooo jealous  November 18th   lt 3 @jaspreetgill Remember me when your famous   @jaspreetgill http   twitpic com 6o84k   Jas seriously you are amazing  I can t wait until I own one of your drawings   Demi Demi Demi  I had to add to the trending topics ,5
24644,BeccaarrFJJP,@tommcfly http   twitpic com 6g55n   this one  work this morning  whatta chore  but can t wait to do elliot minor promo  i love you boys and can t wait for july 8th   buying sims 3 today ,5
24649,Beccaboo_xox,Waiting For Photoshop To Download  So Impatient  I Miss @Eviie Xo  My Mom Wants To Put My Puppy Down       @EviieXo #Amazeballs LMAO   It Was On Perez Hilton  amp  Katy Perrys Tweets   I Thought It Was Funny    Haha   X @EviieXo Sickened  Why M dear  http   twitpic com 806aj   @ Plum     Embarressing In My Part  http   twitpic com 806d0   I Miss Everyone Already  @iamdamnsam Thanks For Following  #musicmonday Decode Paramore  #wefollow #music #acting #hello kitty ,5
