,username,tweet,cluster
0,000catnap000,kinda miss my mom  shouldn t have called her today    @Wumbologist huh uhu   i see dead people xD abhalte kann ich dich ned  awake since six o clock    i had two hours sleep anyway   going to visit my sweetheart jasmin in hospital  this is one of the cartoons i used to watch together with my brother  http   bit ly 15kZmW     good old times  @Wumbologist hmmm   why not  can t get enough of it  http   bit ly 134sSZ,5
15,00Davo,@slix00 Only place I know for Achron communication is Twitter  although http   chronofrag com looks pretty neat  ,5
23,00ShaDix00,@jonasbrothers http   twitpic com 7kf4b   Yaaay  I pre ordered mine   And you know what I ve learned   postal delivery sucks  But u g     @ddlovato awesome picture  wow your talents just dont end ,5
50,00soph00,On my laptop but in an awkward position and cant be bothered to move   My back hurts  Watching Big Brother XD Rodrego is well cuute xx shame he s gay  @jonasbrothers http   twitpic com 5o0ze   Addicted to the song already so i can t wait to see the video  Just got back from camping  twas fun ,5
66,012808frae,great song  http   bit ly 3IDrJV,5
67,015Dennis,Yesterday visited freefestival   still recovering  Today i m going to my guys at the  Landmachtdagen  http   tinyurl com qnoyjv,5
78,020WebDesign,@AndrewKelsall   just made space for more retweets   Excellent illusion                       http   bit ly U933e,5
101,03xyou,http   twitpic com 3ixct @missrena and @itstheant  let do this again    lt 3,5
160,08vintagelove,@Shannannagin haha  Thanks Shannon   3 out of 5 boats got first  Beach with the Berks bests   http   twitpic com 6rnmr   PS   There were 6 boats in this race   Off to Hershey Park with a friend I havent seen since last summer  ,5
178,09kate,Doesnt know how to send direct messages  http   twitpic com 6by6n   Me and some friends  xx @mileycyrus  did you win anyting sorry in England I dont know ,5
205,0Sarah0,Luv it  Both my teams in the finals     having a luvly day http   tinyurl com ckbmkc,5
246,0helenka,@drwhogurl hey  no tengo credit  tried calling you from school today  no cred sucks      but in reply to your text  PICTURE NOW     lt 33 me quondam mirabitur orbis  i can promise that  officially confirmed  next sacrament  marriage  now THAT will be interesting  http   twitpic com 6bwuf   a little in love with this picture  http   twitpic com 6bwxa   aaaaand another pic of Lexie that I love  Valentine s are lame so I ll bring you flowers just for no occasion ,5
256,0jim,Hi @CindaLee   Thank you kindly for the #woofwednesday shout out  Hope my tweet finds you well    Happy Thursday  http   bit ly 13pSon,5
264,0lli,Yes  I #Bubble #Tweet too    http   bbltwt com 6e0ac,5
286,0nlyLosersTweet,@ddlovato It is the one with the ridiculously long subject line sent by Danil47 http   tinyurl com ag4qpb PLEASE check your myspace inbox ,5
304,0ptimist,Up  is out in 3D    IMAX it iss   But when the hell will it open in Hyd  Poker isn t nearly as fun as it ought to be  http   tinyurl com dxt4on RLOL krishashok is too good     post http   tinyurl com cqec2r   Calvin rocks  http   images ucomics com comics ch 2009 ch090601 gif,5
305,0r1,Checking http   tinyurl com oyegoh to see where in the Atlantic Ocean my dad is    they re 5th   goooo daddy    ,5
309,0sarah,wishes she was at give it a name today  THE BLACKOUT AND ENTER SHIKARI    @pinpoint uk YEAH TORI AND GRACE     pinpoint live  gt  http   ustre am 2wLS  http   bit ly jm13b   WATO  THEN SILVERSTIEN  THEN TBO  live  right now   in cardifffff   ,5
315,0therPip,@coollike come on alan and alex s blogtv http   www blogtv com people fallofautumndistro ,5
318,0u4,loves this weeks updates     http   plurk com p vevvp,5
336,0xytocin,Fucking cool  http   bit ly xADoe,5
357,100MonkeysFans,Final East Coast shows     http   tinyurl com m7zpoz,5
364,100ftzombie,The Half Pipe  New cinema idea with luxury beanbags from Hoyts  Not in Sydney though  http   tinyurl com qvmzfc Why Prototype  gt  Infamous  http   tinyurl com mdgs2y  it arrived in our office today but I had to let the other guys play until I get back  @figuromo would but packing for my trip tomorrow at 8am  @ashadihopper there s a good caleaner I used called Getosky UrArse  @CarriageWorks it was engagement photos  I didnt have permit so I hope I dont get in trouble  @jasondavey boom tish     still got it ,5
404,1033fmlgr,Katerina now joining Vasilis in studio with the latest gossip  http   tinyurl com as4opy Tonight Eurovision Semi Final Greece and Cyprus   http   bit ly TKjzq @TheFinanceCoach your welcome  @mikroanalogo  waves hello    How are you  Kala  we have strange weather  bank holiday Monday coming up and Anna Vissi concert 2moro Opaa  Ola Kala LOL Dimitrious says simon cowell must some some Greek in him  @emiliapaps I want the moon hehe me and the moon go way back  Diversity beat the Boyle   Tribute to Stelios Kazantzides  amp  Grigoris Bithikotsis concert this Saturday   http   bit ly hTTjn @TheFinanceCoach Yay Bravo  Opa  ,5
413,1059therock,Last week to score FREE tix to BONNAROO    proud mary    http   twurl nl g087fj Nooner  Your requests and tix to see the Sounds play at high noon   proud mary  http   twurl nl 1k2uo4 Sex  drugs and Bonnaroo   now seriously  is there anything better   oh yeah  FREE tix   proud mary  http   twurl nl borxho Noonerville    your requests and free souns tix   proud mary  http   twurl nl x6772x Late great    solo   Listen up   proud mary     http   twurl nl 37454q,5
432,10ak,http   twitpic com 6bfxf Late night sushi wit the cousins  Avon  Mel  Seanie  Holla  Track12 lt 3 must b jealous  but happy meals r good   ,5
497,11forgottenlaws,my top pick   http   tinyurl com cf7tm2,5
545,123bekx123,very tired  and nervous about work experience tomorrow  don t like nerves  http   twitpic com 7wwft   AWWW  Merlin  This was my Rabbit  He Passed away a couple of years ago   http   twitpic com 7wwft   thanks  I miss him  thats in the living room  he had a growth on his cheek  i was lucky to get this pic cos     happy Fathers Day Father  X   Love You X i can t upload i great pic onto twitpic from my phone  my phone still sucks  Wow i did that with no characters to spare  Skills or What peoples ,5
556,123g_comments,its okay            http   bit ly T2SjA BONES     I love you my sister    weird  loud and all     HAPPY MOTHER S DAY   Sorry this came sooo late  I learned    http   bit ly cipqP Dear Sanjana Thankyou for the email   it made me sad   I hope we are friends together soon  miss you  Finn  http   bit ly SiTtY boring    only music there    nothing else  http   bit ly I7Y7W there are better ones right  http   bit ly B8GBk Thank u Noune for your warm wishes    http   bit ly flINO i luv those words   n the music as well   sweet card   http   bit ly vcDhS thank you po daddy   love you po  take care always   http   bit ly CFuqM Thanks a lot    You made me smile        You have a safe trip  amp  stay in touch  amp  miss me a lot     Ummaahhh    http   bit ly yxeVB This is for you Rainie Sorry  Im late   http   bit ly 17VC8n,5
557,123ilydana,In  Church         Tweet with Me  http   myloc me 2clT,5
569,123wwe456,check out this funny movie  http   tinyurl com d3qwar,5
667,13fernanda13,@jonasbrothers http   twitpic com 7gowf   OK WHAT ABOUT THIS MEXICO BRAZIL AND ARGENTINA WANTS THE JONAS BROTHERS     ,5
682,13o5,Fuckin rain just killed mi nets  i was on a download spree http   twitpic com 6ap6b   Oatmeal Raisin Cookies  Watching The Fugitive  great movie,5
692,13thduke,suspect price fixing on the freezer from ebay       fillet on hold  @Rotimer a higher bid with a max of   20 i laid   21 down n it went for   22 i want this one but ash wont have it http   tinyurl com nw84ym  ,5
720,143makeup,@LaurenConrad you can watch it here http   bit ly ezqMk   ,5
746,15Stepz,@LAmale You are lucky then  Estonia is a small country  so no one here has pools  they are going to beach in summer http   twitpic com 5cnik   Decorating my cake  It was so hot in there http   twitpic com 5cnn4   Cold winter morning  http   twitpic com 5cnwh   Clouds above my garden  Just had a bath  I feel so fresh  like a newborn  Now eating chocolate cookies yum  and drinking Cappy Ice Fruit   chill @LAmale http   twitpic com 5djj7   lol  hilarious  wait   is it George Bush  The one who gets with a shoe or  sth @fwuzzfwuzz You re welcome  I love languages and want to learn them more  @peterfacinelli Hello  You did a great job in Twilight  I loved it  You re great  Have a nice weekend  The next question is  What kind of man exactly  the man  can be your sister  If you know the answer  say it out loud  going for a walk   give me some riddles while I m away  I can answer them when I m back love  15Step  @LAmale good morning there  @LAmale you just can make me laugh  @peterfacinelli hahah  yeah  i think the same  i know how it feels i ll go to hair salon tomorrow  cut my hair a little  haha  tweeting  getting high  @kaylenecastro you re welcome  what s up  smells like i should go shopping  i want some sweets  i ll go and get some sweets now  talk to you later guys  hello  me is back  damn  need to take a glass of water soon  these cookies make me so thirsty @kaylenecastro yes  i studied biology and now i m waiting for replies i never got  maybe i m lucky  and i went for a walk  it rained @peterfacinelli lol  you re hilarious ,5
808,18152,hi it s cool   ya  i have msn   apple chic@live com  ,5
814,182blinkme,this is the song for this teusday   SWEEEEEET    hope yur okay  x  x     http   blip fm  8fl17 yawn  off to work now  i wish i lived in LA i could go to the FSAS thing  @trvsbrkr http   twitpic com 84iha   that is a SWEET t shirt dude  to bad only a few places sell FSS in england ,5
828,18lisa,Marketing mom s dream  Teddi wins most artistic award   K garten graduation  Only 16 more years left   http   twitpic com 6m2v9,5
838,190east,@snapgrrl my assassination attempts have been less than 100  however  Report  High Line opening on Tuesday  And don t bring 1 700 of your closest friends  or else  http   tinyurl com oomvrc  via @curbed    gt  ,5
878,1998girly,is really BORED      http   plurk com p 13cyrd,5
902,19_greeneyes_83,@rbrtpttnsn http   twitpic com 64rks   that s really a little bit scary  but it looks fine   ,5
906,19c816tf9227,@sazmi Hey   Vote for Tom Felton  He s currently in 3rd place  http   bit ly VOTETOM spead the word  Vote as many times as you can   @casfosk Hey   Vote for Tom Felton  He s currently in 3rd place  http   bit ly VOTETOM spead the word  Vote as many times as you can   @FreakyCaramel Hey   Vote for Tom Felton  He s currently in 3rd place  http   bit ly VOTETOM spead the word  Vote as many times as you can @sazmi Hey   Vote for @TomFelton  He s currently in 3rd place  http   bit ly votetom spead the word  Vote as many times as you can  @a HarryPotter Hey   Vote for @TomFelton  He s currently in 3rd place  http   bit ly votetom spead the word  Vote as many times as you can @kassy  Hey   Vote for @TomFelton  He s currently in 3rd place  http   bit ly votetom spead the word  Vote as many times as you can @murz13 Hey   Vote for @TomFelton  He s currently in 3rd place  http   bit ly votetom spead the word  Vote as many times as you can  @elaine 11 Hey   Vote for @TomFelton  He s currently in 3rd place  http   bit ly votetom spead the word  Vote as many times as you can  @miyukii Hey   Vote for @TomFelton  He s currently in 3rd place  http   bit ly votetom spread the word  Vote as many times as you can  @WitchAmy Hey   Vote for @TomFelton  He s currently in 3rd place  http   bit ly votetom spread the word  Vote as many times as you can  @JossPotter Hey   Vote for @TomFelton  He s currently in 3rd place  http   bit ly votetom spread the word  Vote as many times as you can @kritoO Hey   Vote for @TomFelton  He s currently in 3rd place  http   bit ly votetom spread the word  Vote as many times as you can  @ChrissiD Hey   Vote for @TomFelton  He s currently in 3rd place  http   bit ly votetom spread the word  Vote as many times as you can  @havefaith717 Hey   Vote for @TomFelton  He s currently in 3rd place  http   bit ly votetom spread the word  Vote as many times as you can @shanajaca Hey   Vote for @TomFelton  He s currently in 3rd place  http   bit ly votetom spread the word  Vote as many times as you can  @wendelasmit Hey   Vote for @TomFelton  He s currently in 3rd place  http   bit ly votetom spread the word  Vote as many times as you can @AudraNicole For Mr  Twitter Universe  http   bit ly votetom @Lizgmaz Hey   Vote for @TomFelton  He s currently in 3rd place  http   bit ly votetom spread the word  Vote as many times as you can  @Peca79 Hey   Vote for @TomFelton  He s currently in 3rd place  http   bit ly votetom spread the word  Vote as many times as you can  @MyRobsession Hey   Vote for @TomFelton  He s currently in 3rd place  http   bit ly votetom spread the word  Vote as many times as you can @Carly154 Hey   Vote for @TomFelton  He s currently in 3rd place  http   bit ly votetom spread the word  Vote as many times as you can  @smartyshortie Hey   Vote for @TomFelton  He s currently in 3rdplace  http   bit ly votetom spread the word  Vote as many times as you can @smalfoyblack Hey   Vote for @TomFelton  He s currently in 3rd place  http   bit ly votetom spread the word  Vote as many times as you can @barefootwest Hey   Vote for @TomFelton  He s currently in 3rd place  http   bit ly votetom spread the word  Vote as many times as you can @snapesflower Hey   Vote for @TomFelton  He s currently in 3rd place  http   bit ly votetom spread the word  Vote as many times as you can @plm3010 Hey   Vote for @TomFelton  He s currently in 3rd place  http   bit ly votetom spread the word  Vote as many times as you can  @alysonporter Hey   Vote for @TomFelton  He s currently in 3rd place  http   bit ly votetom spread the word  Vote as many times as you can @DaniMazur Hey   Vote for @TomFelton  He s currently in 3rd place  http   bit ly votetom spread the word  Vote as many times as you can  @FELTBEATS Hey   Vote for @TomFelton  He s currently in 3rd place  http   bit ly votetom spread the word  Vote as many times as you can  @lumalfoy Hey   Vote for @TomFelton  He s currently in 3rd place  http   bit ly votetom spread the word  Vote as many times as you can  @dracontia Hey   Vote for @TomFelton  He s currently in 3rd place  http   bit ly votetom spread the word  Vote as many times as you can  @just4joshie Hey   Vote for @TomFelton  He s currently in 3rd place  http   bit ly votetom spread the word  Vote as many times as you can @Toy town Hey   Vote for @TomFelton  He s currently in 3rd place  http   bit ly votetom spread the word  Vote as many times as you can  @LTCmusic Hey   Vote for @TomFelton  He s currently in 3rd place  http   bit ly votetom spread the word  Vote as many times as you can  @TheBellWitch Hey   Vote for @TomFelton  He s currently in 3rd place  http   bit ly votetom spread the word  Vote as many times as you can @its jamiee Hey   Vote for @TomFelton  He s currently in 3rd place  http   bit ly votetom spread the word  Vote as many times as you can @wjbleming Hey   Vote for @TomFelton  He s currently in 3rd place  http   bit ly votetom spread the word  Vote as many times as you can  @Ariel a Hey   Vote for @TomFelton  He s currently in 3rd place  http   bit ly votetom spread the word  Vote as many times as you can  @mary hl Hey   Vote for @TomFelton  He s currently in 3rd place  http   bit ly votetom spread the word  Vote as many times as you can  @Snatalia Hey   Vote for @TomFelton  He s currently in 3rd place  http   bit ly votetom spread the word  Vote as many times as you can  @StephanieDJL Hey   Vote for @TomFelton  He s currently in 3rd place  http   bit ly votetom spread the word  Vote as many times as you can @xKirstGottx Hey   Vote for @TomFelton  He s currently in 3rd place  http   bit ly votetom spread the word  Vote as many times as you can @deiashadows Hey   Vote for @TomFelton  He s currently in 3rd place  http   bit ly votetom spread the word  Vote as many times as you can @lula snape Hey   Vote for @TomFelton  He s currently in 3rd place  http   bit ly votetom spread the word  Vote as many times as you can @pearlii Hey   Vote for @TomFelton  He s currently in 3rd place  http   bit ly votetom spread the word  Vote as many times as you can @flaminglip  Hey   Vote for @TomFelton  He s currently in 3rd place  http   bit ly votetom spread the word  Vote as many times as you can @resabug Hey   Vote for @TomFelton  He s currently in 3rd place  http   bit ly votetom spread the word  Vote as many times as you can @PutuAryana Hey   Vote for @TomFelton  He s currently in 3rd place  http   bit ly votetom spread the word  Vote as many times as you can @thechai Hey   Vote for @TomFelton  He s currently in 3rd place  http   bit ly votetom spread the word  Vote as many times as you can @gemsupernova Hey   Vote for @TomFelton  He s currently in 3rd place  http   bit ly votetom spread the word  Vote as many times as you can @mhaemee Hey   Vote for @TomFelton  He s currently in 3rd place  http   bit ly votetom spread the word  Vote as many times as you can @xFINExLINEx Hey   Vote for @TomFelton  He s currently in 3rd place  http   bit ly votetom spread the word  Vote as many times as you can @FELTBEATS DannyGokey might catch up to @TomFelton  Vote   http   bit ly votetom @littlebitky DannyGokey might catch up with @TomFelton  Vote   http   bit ly votetom Spread the word  @SherieheartsRob DannyGokey might catch up with @TomFelton  Vote   http   bit ly votetom Spread the word  @BrunaDido DannyGokey s seriously catching up  Continue voting for @TomFelton  http   bit ly votetom Spread the word  @YvetteRodrigues DannyGokey s seriously catching up  Continue voting for @TomFelton  http   bit ly votetom Spread the word  @xoemmmaxo DannyGokey s seriously catching up  Continue voting for @TomFelton  http   bit ly votetom Spread the word  @paramour 16 DannyGokey s seriously catching up  Continue voting for @TomFelton  http   bit ly votetom Spread the word  @EPBXO DannyGokey s seriously catching up  Continue voting for @TomFelton  http   bit ly votetom Spread the word  @LifeMeaningOver DannyGokey s seriously catching up  Continue voting for @TomFelton  http   bit ly votetom Spread the word  @milloy112 DannyGokey s seriously catching up  Continue voting for @TomFelton  http   bit ly votetom Spread the word  @AvantLAube DannyGokey s seriously catching up  Continue voting for @TomFelton  http   bit ly votetom Spread the word ,5
933,1ARK2009,PLEASE help   dire situation  http   u mavrev com e0km,5
956,1ChristianWear,setting up a Christian Clothing Store online   Christian Wear com  amp  Christian Couture com,5
988,1Georgio,@FuriousFerret  As pathetic as it may be  ferrets are still illegal in Portugal  EU   http   bit ly jI0Qh But not in Hungary  ,5
1017,1L0V3PATDTh3CAB,i wisssssshhhhhh i was at bamboozle lt 3    i think i broke my little toe  Photo  marissamarie007    i completely agreee  i have had bad experiences in this house before  http   tumblr com xzm21svw5 THEY EFFING LEFT  COME BACK COBRA ,5
1052,1PATR10T,@johngie  sigh     Everyone had fun rolling around in the mud this weekend   @rodriguezralph In DC they get 5 hours  Man    I m missing out   I only get 3 hours of Phil  Yup   6 months from now    Photo  http   bkite com 07XYV,5
1056,1Pene,Videovia yellowteapot  ladytron playing Brisbane tonight    sobsob  and i   m not going    http   tumblr com x2c1z2q7s,5
1063,1QT2C,@iamdiddy LOve you DIDDY   Diddy live  gt  http   bit ly BeN2t,5
1068,1Radio,smoak says  my show has been hacked       find out more at http   1radio org,5
1100,1UPSwife,@indy44 huh  I thought it was just me  @TXMotorSpeedway making fans stand in blazing sun 4 autographs  Not cool   @CrashGladys I ate the pound cake watching 24 Hours of Le Mans            Tho it was 7 30am   I couldn t have had a better beginning to my day  http   twitpic com 3kvic Be well Helio and thank you for being you   @ladyharley99 ah I missed it   backing up dvr to hear it  @VisionRacing Welcome  Baby Ryder   Congratulations  Heather  amp  Ed ,5
1137,1anne7,Photo  i want more free Havaianas   can anybody give me  hehehe   http   tumblr com xif1x91nv,5
1145,1beachsax11,@janiecemichon sis are u calling me slow  http   twitpic com 4guyp   Im gettin these next week or the red  green and black ones   mall didn t have my size today  givinallmyluv2u thnx  I just got an A  ,5
1154,1billionstrong,@jtarter  Thanks for the offer but no thanks  @TagIts  Thanks mate  You are not allowed to think bad or do bad in heaven   Do you still want to go to heaven   if yes what for    http   tinyurl com non8n7 sketching time    hi all   this is my first post since i join c a 3 years ago   i hope u like it  http   bit ly Mx7EF sketching time    hi all   this is my first post since i join c a 3 years ago   i hope u like it  http   bit ly Crt0A,5
1214,1griselda,http   twitpic com 3kwn6   i want to go to disneyland     i wish i didnt work tomorrow   im not that tired    but i open tomorrow      Wants to watch new moon trailer again  this is such a good story  I may have to reread  I just woke up    yawn  Going to a wedding reception   so excited ,5
1224,1iHFzU,Find out the owner of any cell phone or unlisted number  its great  http   linkbee com 3L02,5
1248,1los,A PIC OF ME  http   twitpic com 6gbbu,5
1287,1ndefinite,using hwitter to unfollow all 450 of you that spam me  THANK THE LORD I MADE THIS FOR ALL MY AMAZING FOLLOWERS   http   twitpic com 6d1df hey friends  if you happen to see a 420 somewhere  take a snap and send it to me  ,5
1297,1ntegr1ty,One last time at Silverstone  http   www formula1 com news features 2009 6 9507 html,5
1311,1p_com_au,That ancient program UNIX is younger than me  http   tinyurl com rdlf8o Yet I can it s progeny better  Out with the old        That ancient program UNIX is younger than me  http   tinyurl com rdlf8o Yet I can understand its progeny better  Out with the old      ,5
1321,1ptilf,@anmathews7154 only as we get older honey   J K   @kristenstewart9 http   twitpic com 5o489   Wow   You r right  that is beautiful   working   try not to get too worked up about it  i m not  ,5
1325,1ratterrier1chi,http   twitpic com 4wvwr   Get up on the wrong side of the bed  ,5
1326,1rawgirl,@rawvelous cool   I made it for my 4yr old to enjoy for lunch   he ate it up  @pheadrus0110 http   twitpic com 6aaiv   charles say s this pic is art  i say its a bizarre pic of me ,5
1333,1rick,@nick ramsay @shibuya246 You guys gained 1000 to 2000 followers in 2 wks  That s some fancy tweetin    http   bit ly 3wpVPW,5
1380,1td1e5t0d4y,Hating Aiden   http   www myspace com aiden ,5
1409,1widesi,shower power  lovin  my new blackberry  http   twitpic com 5f0yi   new kicks ,5
1421,2008digitalboy,http   bit ly j794L  w00t comic posted itself  http   bit ly xp9HU  new comic released itself a few hours again  WOOT Grandma just gave me 100 bucks  I love graduations ,5
1454,20Miledesign,Haven t seen this in ages  Urban Sprinting   http   bit ly SJhYi  Just made my day ,5
1473,20tauri,@forager23 We just saw a raccoon in Central Park   everyone says it must be rabid  So sad to learn that my favorite design y pet store  http   www rowfny com  is packing up  They had the coolest stuff ,5
1481,2112starman,Listening to  Rush   Bastille Day   http   bit ly Pr96J,5
1508,21onlinedating,via @TaylorSwift202  Hi  Thanks for following me  You can get your free Taylor Swift ringtones over at http   alturl com 6fj7 So how s     via @twi5  Hey thnks for following us  Do check out http   twi5 com for all the coolest twitter apps  via @positivitynow   Hi thanks for following  wishing you peach and success    Colin  oh ps  Check this  http   bit ly 8Yk88 how to sp    ,5
1551,23Chaechae,@juicystar007 http   twitpic com 5q17v   you re soo pretty ,5
1556,23Sammy,No images on TwitPic yet  Need to change that   http   twitpic com 6ix40,5
1562,23psd,Never Use Inline Javascript  It   s not 1996   http   bit ly oDlRB,5
1571,24601_,Good morning   It s Monday          http   tinyurl com l2csyc Untitled           http   tinyurl com n73ll7,5
1607,2525_feed,2525  @altim dank je wel  we need it  http   tinyurl com mrrkum 2525  @sevensheaven 2x nee  http   tinyurl com mjhd8t 2525  Moest lachen om 419 t shirt kapper Montie  Blijkt het officiele sponsor Dunya  Multiculti business  htt   http   tinyurl com r97dkw,5
1613,25freebet,@mrbobbybones Bet    25 on anything @ Betfair  get    25 cashback if your bet loses  thats a win win situation   http   tinyurl com cldthh @Mercer2789 Bet    25 on anything @ Betfair  get    25 cashback if your bet loses  thats a win win situation   http   tinyurl com cldthh @thebadblogger Bet    25 on anything @ Betfair  get    25 cashback if your bet loses  thats a win win situation   http   tinyurl com cldthh @beachbuum Bet    25 on anything @ Betfair  get    25 cashback if your bet loses  thats a win win situation   http   tinyurl com cldthh @DerekBlake Bet    25 on anything @ Betfair  get    25 cashback if your bet loses  thats a win win situation   http   tinyurl com cldthh @guardian renata Bet    25 on anything @ Betfair  get    25 cashback if your bet loses  thats a win win situation   http   tinyurl com cldthh,5
1629,26hours,is watching Desperate Housewives   season finale   http   plurk com p uhn6j @iMonic  sorry to hear that  @AngelicaV1 wow  that s awesome  i m so happy for you  btw  happy birthday  shares http   tinyurl com ofsbbf  Archuleta and Cook s concert    http   plurk com p ua6gc says yay  finally got my laptop back   http   plurk com p xen1w,5
1648,28cardiacrehab,is missing Bem      http   plurk com p uhrx3,5
1655,290minus100,wants you to check out his blog and tell all your friends to follow his story     http   www 290minus100 blogspot com wants you to check out his blog and tell your friends to follow his story  http   www 290minus100 blogspot com,5
